Date,Year,Month,DOY,Pcp(mm),Tx(oC),Tn(oC),,
9/30/1921,1921,9,273,0,25.2,9.3,,
10/1/1921,1921,10,274,0,25.2,9.3,,
10/2/1921,1921,10,275,0,24.7,10.3,,
10/3/1921,1921,10,276,0,22.9,11.3,,
10/4/1921,1921,10,277,0,25.6,12.7,,
10/5/1921,1921,10,278,0,23.8,10.3,,
10/6/1921,1921,10,279,0,22.4,10.8,,
10/7/1921,1921,10,280,0,25.2,9.8,,
10/8/1921,1921,10,281,0,25.6,10.8,,
10/9/1921,1921,10,282,0,24.7,11.7,,
10/10/1921,1921,10,283,0,24.7,9.8,,
10/11/1921,1921,10,284,0,24.3,11.3,,
10/12/1921,1921,10,285,0,20.2,8.9,,
10/13/1921,1921,10,286,0,21.5,11.7,,
10/14/1921,1921,10,287,3.9,16.6,13.6,,
10/15/1921,1921,10,288,0,22.4,14.1,,
10/16/1921,1921,10,289,0,23.4,9.3,,
10/17/1921,1921,10,290,0,24.3,8.3,,
10/18/1921,1921,10,291,0,26.5,10.3,,
10/19/1921,1921,10,292,0,27,10.3,,
10/20/1921,1921,10,293,0,27,10.3,,
10/21/1921,1921,10,294,0,22,14.7,,
10/22/1921,1921,10,295,0,15.7,9.3,,
10/23/1921,1921,10,296,5.2,15.7,11.3,,
10/24/1921,1921,10,297,0,16.1,6,,
10/25/1921,1921,10,298,0,15.7,8.3,,
10/26/1921,1921,10,299,0,14.3,8.3,,
10/27/1921,1921,10,300,0,14.8,4.5,,
10/28/1921,1921,10,301,0,18.8,4.5,,
10/29/1921,1921,10,302,0,20.6,6,,
10/30/1921,1921,10,303,0,21.5,4.9,,
10/31/1921,1921,10,304,0,20.6,4.5,,
11/1/1921,1921,11,305,0,23.8,6.4,,
11/2/1921,1921,11,306,0,23.4,6.4,,
11/3/1921,1921,11,307,0,21.1,6.4,,
11/4/1921,1921,11,308,0,24.7,6.9,,
11/5/1921,1921,11,309,0,23.4,10.8,,
11/6/1921,1921,11,310,0,25.2,6.4,,
11/7/1921,1921,11,311,0,23.4,7.4,,
11/8/1921,1921,11,312,0,22.9,4.9,,
11/9/1921,1921,11,313,0,23.4,4.9,,
11/10/1921,1921,11,314,0,22.9,4.5,,
11/11/1921,1921,11,315,0,21.5,4.5,,
11/12/1921,1921,11,316,0,22.9,3.6,,
11/13/1921,1921,11,317,0,22,4.9,,
11/14/1921,1921,11,318,0,18.8,6.9,,
11/15/1921,1921,11,319,0,15.7,6.4,,
11/16/1921,1921,11,320,0,15.2,2.1,,
11/17/1921,1921,11,321,0,12.9,2.1,,
11/18/1921,1921,11,322,0,14.3,-0.3,,
11/19/1921,1921,11,323,0,14.3,-1.7,,
11/20/1921,1921,11,324,0,15.7,0.2,,
11/21/1921,1921,11,325,5.1,14.8,3.6,,
11/22/1921,1921,11,326,11,12,7.4,,
11/23/1921,1921,11,327,0,10.2,6.4,,
11/24/1921,1921,11,328,3,10.2,7.9,,
11/25/1921,1921,11,329,0,14.3,10.8,,
11/26/1921,1921,11,330,0,12,11.3,,
11/27/1921,1921,11,331,0,11.1,11.7,,
11/28/1921,1921,11,332,18.7,14.3,6.9,,
11/29/1921,1921,11,333,0,11.1,7.4,,
11/30/1921,1921,11,334,0,17.5,12.2,,
12/1/1921,1921,12,335,0,16.1,8.9,,
12/2/1921,1921,12,336,0,13.4,4.9,,
12/3/1921,1921,12,337,0,16.6,8.9,,
12/4/1921,1921,12,338,0,16.1,1.1,,
12/5/1921,1921,12,339,0,16.1,1.7,,
12/6/1921,1921,12,340,0,14.8,1.1,,
12/7/1921,1921,12,341,0,14.8,0.6,,
12/8/1921,1921,12,342,0,13.8,2.6,,
12/9/1921,1921,12,343,0,13.8,1.1,,
12/10/1921,1921,12,344,0,14.8,0.6,,
12/11/1921,1921,12,345,0,14.3,1.7,,
12/12/1921,1921,12,346,0,15.2,6,,
12/13/1921,1921,12,347,0,15.7,1.1,,
12/14/1921,1921,12,348,0,15.2,-0.3,,
12/15/1921,1921,12,349,0,12,0.6,,
12/16/1921,1921,12,350,0,13.4,0.6,,
12/17/1921,1921,12,351,0,10.2,1.7,,
12/18/1921,1921,12,352,0,11.1,5.5,,
12/19/1921,1921,12,353,2.1,12,4,,
12/20/1921,1921,12,354,11.7,11.6,8.9,,
12/21/1921,1921,12,355,6.5,12.9,6,,
12/22/1921,1921,12,356,17,11.1,6.4,,
12/23/1921,1921,12,357,10.4,9.3,4.9,,
12/24/1921,1921,12,358,1.8,10.7,8.9,,
12/25/1921,1921,12,359,40.2,14.8,8.3,,
12/26/1921,1921,12,360,5.5,12.9,9.8,,
12/27/1921,1921,12,361,17.2,14.3,10.3,,
12/28/1921,1921,12,362,0,13.4,6.9,,
12/29/1921,1921,12,363,2.1,10.7,8.3,,
12/30/1921,1921,12,364,0,15.7,9.8,,
12/31/1921,1921,12,365,0,11.6,8.3,,
1/1/1922,1922,1,1,35.1,11.1,9.3,,
1/2/1922,1922,1,2,0,12.5,3.6,,
1/3/1922,1922,1,3,0,11.1,4.9,,
1/4/1922,1922,1,4,0,8.4,4.5,,
1/5/1922,1922,1,5,0,11.1,0.2,,
1/6/1922,1922,1,6,26.7,7.5,4.9,,
1/7/1922,1922,1,7,0,8.9,3,,
1/8/1922,1922,1,8,0,12.5,0.2,,
1/9/1922,1922,1,9,0,10.2,1.7,,
1/10/1922,1922,1,10,0,11.6,0.2,,
1/11/1922,1922,1,11,0,8.9,1.7,,
1/12/1922,1922,1,12,0,10.2,1.7,,
1/13/1922,1922,1,13,0,8,-0.3,,
1/14/1922,1922,1,14,0,5.2,0.2,,
1/15/1922,1922,1,15,0,4.8,0.2,,
1/16/1922,1922,1,16,0,3.9,2.1,,
1/17/1922,1922,1,17,0,11.6,2.6,,
1/18/1922,1922,1,18,0,3.9,1.7,,
1/19/1922,1922,1,19,0,6.1,-2.2,,
1/20/1922,1922,1,20,0,7.5,-3.2,,
1/21/1922,1922,1,21,0,8.9,-2.2,,
1/22/1922,1922,1,22,0,9.3,-2.2,,
1/23/1922,1922,1,23,0,12,-1.3,,
1/24/1922,1922,1,24,0,12.9,-1.7,,
1/25/1922,1922,1,25,0,12.9,-1.7,,
1/26/1922,1922,1,26,0,13.8,-1.3,,
1/27/1922,1922,1,27,0,12,4,,
1/28/1922,1922,1,28,0,8.9,-2.2,,
1/29/1922,1922,1,29,0,4.8,2.6,,
1/30/1922,1922,1,30,22,4.8,1.1,,
1/31/1922,1922,1,31,0,8,2.1,,
2/1/1922,1922,2,32,0,10.7,0.2,,
2/2/1922,1922,2,33,0,11.1,0.6,,
2/3/1922,1922,2,34,0,11.6,0.2,,
2/4/1922,1922,2,35,0,12.9,0.6,,
2/5/1922,1922,2,36,0,15.7,2.1,,
2/6/1922,1922,2,37,0,15.2,1.1,,
2/7/1922,1922,2,38,0,13.4,2.6,,
2/8/1922,1922,2,39,17.8,15.7,8.9,,
2/9/1922,1922,2,40,31.2,12.5,6.9,,
2/10/1922,1922,2,41,29.6,12.5,6,,
2/11/1922,1922,2,42,2.5,12,4.9,,
2/12/1922,1922,2,43,0,12,1.7,,
2/13/1922,1922,2,44,0,12.5,2.6,,
2/14/1922,1922,2,45,0,13.4,3,,
2/15/1922,1922,2,46,3.1,11.1,7.4,,
2/16/1922,1922,2,47,0,15.7,4.9,,
2/17/1922,1922,2,48,3.1,16.1,7.4,,
2/18/1922,1922,2,49,1.1,14.8,10.3,,
2/19/1922,1922,2,50,29.4,13.4,8.9,,
2/20/1922,1922,2,51,0,10.7,8.9,,
2/21/1922,1922,2,52,1.3,12.5,5.5,,
2/22/1922,1922,2,53,0,12,6,,
2/23/1922,1922,2,54,0,12.5,5.5,,
2/24/1922,1922,2,55,8.2,14.3,8.9,,
2/25/1922,1922,2,56,2.9,16.1,9.3,,
2/26/1922,1922,2,57,0,15.2,10.3,,
2/27/1922,1922,2,58,0,17.9,5.5,,
2/28/1922,1922,2,59,0,16.1,6,,
3/1/1922,1922,3,60,0,15.7,5.5,,
3/2/1922,1922,3,61,0,15.2,4,,
3/3/1922,1922,3,62,3.4,14.8,8.3,,
3/4/1922,1922,3,63,5.1,14.3,6.9,,
3/5/1922,1922,3,64,0,13.4,3,,
3/6/1922,1922,3,65,0,17.9,6,,
3/7/1922,1922,3,66,0,14.8,6.4,,
3/8/1922,1922,3,67,0,16.1,4,,
3/9/1922,1922,3,68,0,14.3,2.6,,
3/10/1922,1922,3,69,0,11.1,5.5,,
3/11/1922,1922,3,70,13.6,11.1,1.7,,
3/12/1922,1922,3,71,0,16.1,4.5,,
3/13/1922,1922,3,72,0,14.3,4.9,,
3/14/1922,1922,3,73,1.5,17,9.3,,
3/15/1922,1922,3,74,3.4,12.9,8.3,,
3/16/1922,1922,3,75,1.2,12.5,6.9,,
3/17/1922,1922,3,76,0,16.1,3,,
3/18/1922,1922,3,77,0,16.6,2.1,,
3/19/1922,1922,3,78,0,17.9,2.6,,
3/20/1922,1922,3,79,0,19.7,4.9,,
3/21/1922,1922,3,80,0,19.3,7.4,,
3/22/1922,1922,3,81,0,17.9,5.5,,
3/23/1922,1922,3,82,2.2,15.2,7.9,,
3/24/1922,1922,3,83,0,18.4,10.3,,
3/25/1922,1922,3,84,0,18.4,3,,
3/26/1922,1922,3,85,0,15.2,7.9,,
3/27/1922,1922,3,86,0,15.2,4,,
3/28/1922,1922,3,87,0,15.2,8.3,,
3/29/1922,1922,3,88,0,18.8,9.3,,
3/30/1922,1922,3,89,0,15.7,6.9,,
3/31/1922,1922,3,90,5.4,15.2,8.3,,
4/1/1922,1922,4,91,0,19.3,6.4,,
4/2/1922,1922,4,92,0,21.5,11.3,,
4/3/1922,1922,4,93,0,22,7.9,,
4/4/1922,1922,4,94,0,15.2,4.9,,
4/5/1922,1922,4,95,0,15.7,7.9,,
4/6/1922,1922,4,96,0,20.2,7.9,,
4/7/1922,1922,4,97,0,15.7,7.9,,
4/8/1922,1922,4,98,0,14.8,6,,
4/9/1922,1922,4,99,0,16.6,4.9,,
4/10/1922,1922,4,100,0,17.9,4.5,,
4/11/1922,1922,4,101,0,14.8,3,,
4/12/1922,1922,4,102,17.8,11.6,6.4,,
4/13/1922,1922,4,103,0,14.8,2.6,,
4/14/1922,1922,4,104,0,14.8,9.3,,
4/15/1922,1922,4,105,0,15.2,3,,
4/16/1922,1922,4,106,0,14.8,4.9,,
4/17/1922,1922,4,107,0,17,6.9,,
4/18/1922,1922,4,108,0,19.7,4.9,,
4/19/1922,1922,4,109,0,22.4,3.6,,
4/20/1922,1922,4,110,0,22.4,6,,
4/21/1922,1922,4,111,0,20.6,4.9,,
4/22/1922,1922,4,112,0,21.1,6,,
4/23/1922,1922,4,113,0,24.3,6,,
4/24/1922,1922,4,114,0,25.6,9.3,,
4/25/1922,1922,4,115,0,21.5,8.3,,
4/26/1922,1922,4,116,0,20.2,6.4,,
4/27/1922,1922,4,117,0,22.9,5.5,,
4/28/1922,1922,4,118,0,23.8,6.9,,
4/29/1922,1922,4,119,0,22.9,6,,
4/30/1922,1922,4,120,0,23.4,6,,
5/1/1922,1922,5,121,0,26.1,8.9,,
5/2/1922,1922,5,122,0,26.1,13.2,,
5/3/1922,1922,5,123,0,25.6,14.7,,
5/4/1922,1922,5,124,0,25.6,8.9,,
5/5/1922,1922,5,125,0,27.9,12.7,,
5/6/1922,1922,5,126,0,24.7,9.8,,
5/7/1922,1922,5,127,0,19.3,8.3,,
5/8/1922,1922,5,128,2.6,15.2,8.3,,
5/9/1922,1922,5,129,3.6,13.8,4.9,,
5/10/1922,1922,5,130,0,19.3,4.9,,
5/11/1922,1922,5,131,0,22.4,4.5,,
5/12/1922,1922,5,132,0,26.5,7.4,,
5/13/1922,1922,5,133,0,29.3,10.8,,
5/14/1922,1922,5,134,0,29.3,14.7,,
5/15/1922,1922,5,135,0,29.7,18.5,,
5/16/1922,1922,5,136,0,29.7,13.6,,
5/17/1922,1922,5,137,0,22.4,10.8,,
5/18/1922,1922,5,138,0,16.6,9.8,,
5/19/1922,1922,5,139,0,17.5,12.2,,
5/20/1922,1922,5,140,14.4,17.9,9.8,,
5/21/1922,1922,5,141,0,22.4,5.5,,
5/22/1922,1922,5,142,0,26.1,8.3,,
5/23/1922,1922,5,143,0,26.1,8.9,,
5/24/1922,1922,5,144,0,23.8,7.4,,
5/25/1922,1922,5,145,0,19.3,7.9,,
5/26/1922,1922,5,146,0,22.9,9.8,,
5/27/1922,1922,5,147,0,27.5,12.2,,
5/28/1922,1922,5,148,0,27,11.3,,
5/29/1922,1922,5,149,0,29.7,8.9,,
5/30/1922,1922,5,150,0,28.8,11.7,,
5/31/1922,1922,5,151,0,24.3,11.7,,
6/1/1922,1922,6,152,3,21.5,12.2,,
6/2/1922,1922,6,153,0,22,11.7,,
6/3/1922,1922,6,154,0,22.9,10.3,,
6/4/1922,1922,6,155,0,25.2,10.8,,
6/5/1922,1922,6,156,0,22.9,11.3,,
6/6/1922,1922,6,157,0,24.3,11.7,,
6/7/1922,1922,6,158,0,23.4,15.1,,
6/8/1922,1922,6,159,0,21.1,13.6,,
6/9/1922,1922,6,160,0,20.6,12.7,,
6/10/1922,1922,6,161,0,21.5,10.3,,
6/11/1922,1922,6,162,0,21.5,12.7,,
6/12/1922,1922,6,163,0,22.9,11.3,,
6/13/1922,1922,6,164,0,30.2,12.7,,
6/14/1922,1922,6,165,0,29.3,12.7,,
6/15/1922,1922,6,166,0,25.2,10.3,,
6/16/1922,1922,6,167,0,29.7,11.7,,
6/17/1922,1922,6,168,0,31.1,14.1,,
6/18/1922,1922,6,169,0,31.1,15.1,,
6/19/1922,1922,6,170,0,31.1,13.2,,
6/20/1922,1922,6,171,0,26.1,11.7,,
6/21/1922,1922,6,172,0,24.7,11.7,,
6/22/1922,1922,6,173,0,26.1,9.8,,
6/23/1922,1922,6,174,0,31.1,13.6,,
6/24/1922,1922,6,175,0,32.5,13.6,,
6/25/1922,1922,6,176,0,33.8,18,,
6/26/1922,1922,6,177,0,33.8,17.5,,
6/27/1922,1922,6,178,0,28.4,15.6,,
6/28/1922,1922,6,179,0,27,13.6,,
6/29/1922,1922,6,180,0,27.9,12.2,,
6/30/1922,1922,6,181,0,29.3,12.7,,
7/1/1922,1922,7,182,0,32.5,13.6,,
7/2/1922,1922,7,183,0,33.4,16.6,,
7/3/1922,1922,7,184,0,32.5,17,,
7/4/1922,1922,7,185,0,32.9,16.6,,
7/5/1922,1922,7,186,0,30.6,17,,
7/6/1922,1922,7,187,0,32,16,,
7/7/1922,1922,7,188,0,26.5,15.1,,
7/8/1922,1922,7,189,0,24.7,13.2,,
7/9/1922,1922,7,190,0,23.8,13.2,,
7/10/1922,1922,7,191,0,24.7,13.2,,
7/11/1922,1922,7,192,0,28.8,15.1,,
7/12/1922,1922,7,193,0,27.9,13.2,,
7/13/1922,1922,7,194,0,31.1,12.2,,
7/14/1922,1922,7,195,0,32.9,14.1,,
7/15/1922,1922,7,196,0,33.8,16,,
7/16/1922,1922,7,197,0,31.1,16,,
7/17/1922,1922,7,198,0,29.3,16.6,,
7/18/1922,1922,7,199,0,28.8,11.7,,
7/19/1922,1922,7,200,0,27.5,17,,
7/20/1922,1922,7,201,0,26.1,14.7,,
7/21/1922,1922,7,202,0,26.5,12.7,,
7/22/1922,1922,7,203,0,25.2,11.7,,
7/23/1922,1922,7,204,0,24.7,9.3,,
7/24/1922,1922,7,205,0,26.1,9.8,,
7/25/1922,1922,7,206,0,27.9,10.3,,
7/26/1922,1922,7,207,0,29.3,10.8,,
7/27/1922,1922,7,208,0,31.1,12.2,,
7/28/1922,1922,7,209,0,31.1,12.2,,
7/29/1922,1922,7,210,0,32.5,11.7,,
7/30/1922,1922,7,211,0,32.9,14.7,,
7/31/1922,1922,7,212,0,26.5,14.1,,
8/1/1922,1922,8,213,0,28.4,12.2,,
8/2/1922,1922,8,214,0,30.6,11.3,,
8/3/1922,1922,8,215,0,30.2,12.2,,
8/4/1922,1922,8,216,0,28.8,12.2,,
8/5/1922,1922,8,217,0,30.6,9.3,,
8/6/1922,1922,8,218,0,32.9,12.7,,
8/7/1922,1922,8,219,0,31.1,14.7,,
8/8/1922,1922,8,220,0,27,13.6,,
8/9/1922,1922,8,221,0,27,12.2,,
8/10/1922,1922,8,222,0,27.9,13.2,,
8/11/1922,1922,8,223,0,27,15.6,,
8/12/1922,1922,8,224,0,27.5,14.1,,
8/13/1922,1922,8,225,0,27,10.3,,
8/14/1922,1922,8,226,0,30,12.8,,
8/15/1922,1922,8,227,0,26.1,10.3,,
8/16/1922,1922,8,228,0,28.8,10.8,,
8/17/1922,1922,8,229,0,25.2,10.3,,
8/18/1922,1922,8,230,0,26.1,13.6,,
8/19/1922,1922,8,231,0,26.1,8.9,,
8/20/1922,1922,8,232,0,26.5,10.3,,
8/21/1922,1922,8,233,0,20.6,14.1,,
8/22/1922,1922,8,234,0,20.2,16.6,,
8/23/1922,1922,8,235,0,18.8,16,,
8/24/1922,1922,8,236,0,21.1,16.6,,
8/25/1922,1922,8,237,0,24.3,16.6,,
8/26/1922,1922,8,238,0,26.1,17.5,,
8/27/1922,1922,8,239,0,27,17.5,,
8/28/1922,1922,8,240,0,31.1,20.9,,
8/29/1922,1922,8,241,0,27.5,14.1,,
8/30/1922,1922,8,242,0,26.5,11.3,,
8/31/1922,1922,8,243,0,29.3,11.7,,
9/1/1922,1922,9,244,0.5,29.7,14.1,,
9/2/1922,1922,9,245,0,29.7,12.2,,
9/3/1922,1922,9,246,0,26.5,15.6,,
9/4/1922,1922,9,247,0,23.8,14.7,,
9/5/1922,1922,9,248,0,22.9,20.9,,
9/6/1922,1922,9,249,0,23.8,9.8,,
9/7/1922,1922,9,250,0,27.9,9.3,,
9/8/1922,1922,9,251,0,29.7,12.7,,
9/9/1922,1922,9,252,0,32.5,14.7,,
9/10/1922,1922,9,253,0,33.4,15.6,,
9/11/1922,1922,9,254,0,33.4,13.2,,
9/12/1922,1922,9,255,0,32,14.7,,
9/13/1922,1922,9,256,0,30.6,14.7,,
9/14/1922,1922,9,257,0,32,14.7,,
9/15/1922,1922,9,258,0,32.5,15.6,,
9/16/1922,1922,9,259,0,31.6,16,,
9/17/1922,1922,9,260,0,30.2,10.8,,
9/18/1922,1922,9,261,0,31.1,12.2,,
9/19/1922,1922,9,262,0,30.2,12.7,,
9/20/1922,1922,9,263,0,27,14.7,,
9/21/1922,1922,9,264,0,27.5,12.2,,
9/22/1922,1922,9,265,0,27.5,10.3,,
9/23/1922,1922,9,266,0,26.5,11.7,,
9/24/1922,1922,9,267,0,28.8,12.7,,
9/25/1922,1922,9,268,0,28.8,14.1,,
9/26/1922,1922,9,269,0,23.8,15.1,,
9/27/1922,1922,9,270,0,21.1,12.7,,
9/28/1922,1922,9,271,0,23.4,10.8,,
9/29/1922,1922,9,272,0,24.7,7.4,,
9/30/1922,1922,9,273,0,27,9.3,,
10/1/1922,1922,10,274,0,26.1,10.3,,
10/2/1922,1922,10,275,1.3,19.7,14.7,,
10/3/1922,1922,10,276,6.1,16.6,12.7,,
10/4/1922,1922,10,277,0,19.3,8.9,,
10/5/1922,1922,10,278,0,21.5,8.9,,
10/6/1922,1922,10,279,0,23.4,9.3,,
10/7/1922,1922,10,280,0,22.9,9.3,,
10/8/1922,1922,10,281,2.4,14.8,12.7,,
10/9/1922,1922,10,282,0,19.7,9.3,,
10/10/1922,1922,10,283,2.6,17,12.7,,
10/11/1922,1922,10,284,0,17.9,10.8,,
10/12/1922,1922,10,285,0,19.3,9.8,,
10/13/1922,1922,10,286,0,22,8.9,,
10/14/1922,1922,10,287,0,22.4,9.3,,
10/15/1922,1922,10,288,0,22,9.3,,
10/16/1922,1922,10,289,0,22,9.8,,
10/17/1922,1922,10,290,0,23.8,9.3,,
10/18/1922,1922,10,291,0,22.9,8.3,,
10/19/1922,1922,10,292,0,19.7,6.4,,
10/20/1922,1922,10,293,0,22.9,8.3,,
10/21/1922,1922,10,294,0,24.3,15.1,,
10/22/1922,1922,10,295,0,24.7,10.8,,
10/23/1922,1922,10,296,0,25.6,6.4,,
10/24/1922,1922,10,297,0,25.6,9.8,,
10/25/1922,1922,10,298,0,22.4,4.9,,
10/26/1922,1922,10,299,0,14.8,9.8,,
10/27/1922,1922,10,300,6.5,12.9,8.3,,
10/28/1922,1922,10,301,0.6,15.2,6.9,,
10/29/1922,1922,10,302,0,17,7.9,,
10/30/1922,1922,10,303,0,16.6,3.6,,
10/31/1922,1922,10,304,0,14.8,6,,
11/1/1922,1922,11,305,0,17,3.6,,
11/2/1922,1922,11,306,0,15.2,2.1,,
11/3/1922,1922,11,307,0,14.8,6.9,,
11/4/1922,1922,11,308,0,13.8,3,,
11/5/1922,1922,11,309,0,14.8,1.7,,
11/6/1922,1922,11,310,34.5,8.4,5.5,,
11/7/1922,1922,11,311,28.2,15.2,11.3,,
11/8/1922,1922,11,312,18.6,12.9,9.3,,
11/9/1922,1922,11,313,40.8,12,8.9,,
11/10/1922,1922,11,314,0,13.8,7.9,,
11/11/1922,1922,11,315,0,14.8,6,,
11/12/1922,1922,11,316,0,13.8,4.9,,
11/13/1922,1922,11,317,0,14.8,7.4,,
11/14/1922,1922,11,318,0,15.7,3.6,,
11/15/1922,1922,11,319,0,16.6,3.6,,
11/16/1922,1922,11,320,0,17,4,,
11/17/1922,1922,11,321,0,13.8,6,,
11/18/1922,1922,11,322,0,15.7,4.5,,
11/19/1922,1922,11,323,0,9.3,4.5,,
11/20/1922,1922,11,324,0,12,6.4,,
11/21/1922,1922,11,325,0,12.9,3.6,,
11/22/1922,1922,11,326,0,15.2,3.6,,
11/23/1922,1922,11,327,0,16.1,2.1,,
11/24/1922,1922,11,328,0,15.7,1.7,,
11/25/1922,1922,11,329,0,16.6,2.6,,
11/26/1922,1922,11,330,0,16.6,1.7,,
11/27/1922,1922,11,331,0,14.3,2.1,,
11/28/1922,1922,11,332,0,12.9,6,,
11/29/1922,1922,11,333,0,11.6,2.6,,
11/30/1922,1922,11,334,0,11.6,1.1,,
12/1/1922,1922,12,335,0,14.8,4,,
12/2/1922,1922,12,336,0,15.7,1.7,,
12/3/1922,1922,12,337,0,16.6,0.6,,
12/4/1922,1922,12,338,0,14.3,0.6,,
12/5/1922,1922,12,339,5.5,12.5,7.4,,
12/6/1922,1922,12,340,27.3,12.9,9.3,,
12/7/1922,1922,12,341,11.2,9.8,5.5,,
12/8/1922,1922,12,342,2.2,11.1,4.5,,
12/9/1922,1922,12,343,6.2,8.9,2.6,,
12/10/1922,1922,12,344,27.3,13.4,6.4,,
12/11/1922,1922,12,345,5.5,9.3,6.9,,
12/12/1922,1922,12,346,26.3,10.2,8.3,,
12/13/1922,1922,12,347,15.4,14.3,8.9,,
12/14/1922,1922,12,348,0,12.9,8.3,,
12/15/1922,1922,12,349,0,13.4,4.9,,
12/16/1922,1922,12,350,0,9.3,3,,
12/17/1922,1922,12,351,7.5,12.5,7.4,,
12/18/1922,1922,12,352,0,14.8,6,,
12/19/1922,1922,12,353,0,16.1,8.3,,
12/20/1922,1922,12,354,0,14.8,5.5,,
12/21/1922,1922,12,355,0,16.6,4.5,,
12/22/1922,1922,12,356,0,8.4,6.4,,
12/23/1922,1922,12,357,0,8.4,6.4,,
12/24/1922,1922,12,358,7.5,8.4,6.9,,
12/25/1922,1922,12,359,4.5,9.8,6.9,,
12/26/1922,1922,12,360,0,11.1,8.3,,
12/27/1922,1922,12,361,6.7,10.2,6,,
12/28/1922,1922,12,362,26.1,15.2,8.3,,
12/29/1922,1922,12,363,1.5,9.8,5.5,,
12/30/1922,1922,12,364,0,10.2,6.4,,
12/31/1922,1922,12,365,2.5,14.3,7.9,,
1/1/1923,1923,1,1,0,13.4,3,,
1/2/1923,1923,1,2,0,9.8,3.6,,
1/3/1923,1923,1,3,0,9.3,4.5,,
1/4/1923,1923,1,4,4.7,10.7,6,,
1/5/1923,1923,1,5,0,15.2,7.4,,
1/6/1923,1923,1,6,0,13.4,7.9,,
1/7/1923,1923,1,7,0,13.4,9.8,,
1/8/1923,1923,1,8,0,13.4,6,,
1/9/1923,1923,1,9,0,10.2,6.4,,
1/10/1923,1923,1,10,0,9.3,6.9,,
1/11/1923,1923,1,11,0,11.1,4.5,,
1/12/1923,1923,1,12,0,7.5,1.7,,
1/13/1923,1923,1,13,0,14.3,0.2,,
1/14/1923,1923,1,14,0,10.2,0.6,,
1/15/1923,1923,1,15,0,6.6,2.6,,
1/16/1923,1923,1,16,0,5.7,2.1,,
1/17/1923,1923,1,17,0,16.6,4,,
1/18/1923,1923,1,18,11.1,12.5,2.6,,
1/19/1923,1923,1,19,0,11.1,5.5,,
1/20/1923,1923,1,20,0,16.6,1.1,,
1/21/1923,1923,1,21,0,10.7,1.7,,
1/22/1923,1923,1,22,19,10.7,5.5,,
1/23/1923,1923,1,23,5.9,10.7,4.5,,
1/24/1923,1923,1,24,17.2,10.7,1.1,,
1/25/1923,1923,1,25,0,12.5,0.2,,
1/26/1923,1923,1,26,0,11.1,1.1,,
1/27/1923,1923,1,27,1.4,11.1,4,,
1/28/1923,1923,1,28,0,6.6,3,,
1/29/1923,1923,1,29,0,9.8,3.6,,
1/30/1923,1923,1,30,0,8,2.6,,
1/31/1923,1923,1,31,0,12.5,0.2,,
2/1/1923,1923,2,32,0,8.4,2.1,,
2/2/1923,1923,2,33,0,11.6,-1.3,,
2/3/1923,1923,2,34,0,13.4,3.6,,
2/4/1923,1923,2,35,0,13.8,0.6,,
2/5/1923,1923,2,36,0,11.6,0.6,,
2/6/1923,1923,2,37,0,17,1.7,,
2/7/1923,1923,2,38,0,14.8,1.1,,
2/8/1923,1923,2,39,8.2,7.5,2.1,,
2/9/1923,1923,2,40,0,9.3,3,,
2/10/1923,1923,2,41,2.2,7.1,-0.3,,
2/11/1923,1923,2,42,6.8,9.8,4.9,,
2/12/1923,1923,2,43,1.9,11.6,6.9,,
2/13/1923,1923,2,44,0,10.7,1.7,,
2/14/1923,1923,2,45,0,12.5,2.1,,
2/15/1923,1923,2,46,0,13.8,2.1,,
2/16/1923,1923,2,47,0,17.5,4.9,,
2/17/1923,1923,2,48,0,16.6,2.1,,
2/18/1923,1923,2,49,0,16.6,3.6,,
2/19/1923,1923,2,50,0,17,7.9,,
2/20/1923,1923,2,51,0,18.4,6,,
2/21/1923,1923,2,52,0,18.4,4,,
2/22/1923,1923,2,53,0,15.7,5.5,,
2/23/1923,1923,2,54,0,18.8,8.3,,
2/24/1923,1923,2,55,0,18.8,6,,
2/25/1923,1923,2,56,0,19.3,6.9,,
2/26/1923,1923,2,57,0,19.7,7.9,,
2/27/1923,1923,2,58,0,20.6,10.8,,
2/28/1923,1923,2,59,0,19.3,3,,
3/1/1923,1923,3,60,0.3,17,6,,
3/2/1923,1923,3,61,0,13.4,9.3,,
3/3/1923,1923,3,62,0,12.9,6.4,,
3/4/1923,1923,3,63,0,14.3,3.6,,
3/5/1923,1923,3,64,0,17,2.1,,
3/6/1923,1923,3,65,0,17,3.6,,
3/7/1923,1923,3,66,0,17.9,2.1,,
3/8/1923,1923,3,67,0,16.1,7.4,,
3/9/1923,1923,3,68,0,13.8,4.5,,
3/10/1923,1923,3,69,0,18.8,6.9,,
3/11/1923,1923,3,70,0,18.4,4.5,,
3/12/1923,1923,3,71,0,18.8,4.5,,
3/13/1923,1923,3,72,0,17.9,5.5,,
3/14/1923,1923,3,73,0,16.1,6,,
3/15/1923,1923,3,74,0,21.1,6.4,,
3/16/1923,1923,3,75,0,20.6,2.6,,
3/17/1923,1923,3,76,0,22.4,4.5,,
3/18/1923,1923,3,77,0,23.4,11.3,,
3/19/1923,1923,3,78,0,22,6,,
3/20/1923,1923,3,79,0,20.2,5.5,,
3/21/1923,1923,3,80,0,19.3,9.3,,
3/22/1923,1923,3,81,0,21.1,7.9,,
3/23/1923,1923,3,82,0,20.6,2.1,,
3/24/1923,1923,3,83,0,21.1,3.6,,
3/25/1923,1923,3,84,0,24.3,7.9,,
3/26/1923,1923,3,85,0,25.2,9.8,,
3/27/1923,1923,3,86,0,26.5,10.3,,
3/28/1923,1923,3,87,0,25.2,11.3,,
3/29/1923,1923,3,88,0,22.9,4.9,,
3/30/1923,1923,3,89,0,21.5,6,,
3/31/1923,1923,3,90,0,17,11.7,,
4/1/1923,1923,4,91,8.7,14.8,10.8,,
4/2/1923,1923,4,92,7.1,12.5,10.3,,
4/3/1923,1923,4,93,0,15.2,6,,
4/4/1923,1923,4,94,19.5,11.6,9.8,,
4/5/1923,1923,4,95,13.1,17,12.2,,
4/6/1923,1923,4,96,4.4,16.1,8.9,,
4/7/1923,1923,4,97,0,16.6,6.4,,
4/8/1923,1923,4,98,0,15.2,8.3,,
4/9/1923,1923,4,99,9.5,15.7,6.9,,
4/10/1923,1923,4,100,24.6,20.6,12.7,,
4/11/1923,1923,4,101,0,20.6,7.9,,
4/12/1923,1923,4,102,0,22,9.8,,
4/13/1923,1923,4,103,0,23.8,12.2,,
4/14/1923,1923,4,104,0,24.3,6.9,,
4/15/1923,1923,4,105,0,25.2,10.3,,
4/16/1923,1923,4,106,1.2,16.6,9.3,,
4/17/1923,1923,4,107,0,14.8,9.3,,
4/18/1923,1923,4,108,0,20.6,7.9,,
4/19/1923,1923,4,109,0,22.4,6,,
4/20/1923,1923,4,110,0,20.6,6.9,,
4/21/1923,1923,4,111,0,17.9,4.5,,
4/22/1923,1923,4,112,0,19.3,6.4,,
4/23/1923,1923,4,113,0,22,6,,
4/24/1923,1923,4,114,0,23.4,6.9,,
4/25/1923,1923,4,115,0,25.2,10.3,,
4/26/1923,1923,4,116,0,21.1,9.3,,
4/27/1923,1923,4,117,0,17.5,10.3,,
4/28/1923,1923,4,118,0,16.6,6,,
4/29/1923,1923,4,119,0,19.7,4.9,,
4/30/1923,1923,4,120,0,22,6.4,,
5/1/1923,1923,5,121,0,20.6,7.9,,
5/2/1923,1923,5,122,0,20.6,5.5,,
5/3/1923,1923,5,123,0,22.9,10.3,,
5/4/1923,1923,5,124,0,20.2,10.8,,
5/5/1923,1923,5,125,0,22.9,7.9,,
5/6/1923,1923,5,126,0,25.6,7.4,,
5/7/1923,1923,5,127,0,26.5,7.9,,
5/8/1923,1923,5,128,0,27.9,10.3,,
5/9/1923,1923,5,129,0,24.3,12.2,,
5/10/1923,1923,5,130,0,22.9,7.4,,
5/11/1923,1923,5,131,0,23.8,9.8,,
5/12/1923,1923,5,132,0,24.7,9.3,,
5/13/1923,1923,5,133,0,24.7,12.7,,
5/14/1923,1923,5,134,0,27.9,17,,
5/15/1923,1923,5,135,0,27.9,16,,
5/16/1923,1923,5,136,0,24.7,12.7,,
5/17/1923,1923,5,137,0,18.4,10.8,,
5/18/1923,1923,5,138,0,17.9,8.9,,
5/19/1923,1923,5,139,0,18.4,9.8,,
5/20/1923,1923,5,140,0,19.7,8.9,,
5/21/1923,1923,5,141,0,23.8,8.3,,
5/22/1923,1923,5,142,0,26.1,9.3,,
5/23/1923,1923,5,143,0,23.4,10.3,,
5/24/1923,1923,5,144,0,21.5,10.3,,
5/25/1923,1923,5,145,0,17.5,8.9,,
5/26/1923,1923,5,146,0,19.7,6.4,,
5/27/1923,1923,5,147,0,22,8.3,,
5/28/1923,1923,5,148,0,21.5,9.3,,
5/29/1923,1923,5,149,0,19.3,13.6,,
5/30/1923,1923,5,150,0,19.3,6,,
5/31/1923,1923,5,151,0,20.2,6.4,,
6/1/1923,1923,6,152,0,21.5,8.3,,
6/2/1923,1923,6,153,0,24.7,8.3,,
6/3/1923,1923,6,154,0,25.6,9.8,,
6/4/1923,1923,6,155,0,22.4,10.8,,
6/5/1923,1923,6,156,0,22.9,10.8,,
6/6/1923,1923,6,157,0,22.9,10.8,,
6/7/1923,1923,6,158,0,24.3,10.8,,
6/8/1923,1923,6,159,0,26.1,10.3,,
6/9/1923,1923,6,160,0,28.4,13.2,,
6/10/1923,1923,6,161,0,28.8,12.2,,
6/11/1923,1923,6,162,0,23.8,11.7,,
6/12/1923,1923,6,163,0,20.6,7.9,,
6/13/1923,1923,6,164,0,22,12.7,,
6/14/1923,1923,6,165,0,20.6,7.9,,
6/15/1923,1923,6,166,0,18.4,10.8,,
6/16/1923,1923,6,167,0,19.3,10.8,,
6/17/1923,1923,6,168,0,22,9.3,,
6/18/1923,1923,6,169,0,20.6,10.8,,
6/19/1923,1923,6,170,0,21.5,10.8,,
6/20/1923,1923,6,171,0,21.5,11.3,,
6/21/1923,1923,6,172,0,21.1,11.3,,
6/22/1923,1923,6,173,0,16.1,8.3,,
6/23/1923,1923,6,174,0,19.3,14.1,,
6/24/1923,1923,6,175,0,24.3,12.7,,
6/25/1923,1923,6,176,0,23.4,12.2,,
6/26/1923,1923,6,177,0,24.7,11.3,,
6/27/1923,1923,6,178,0,28.4,9.3,,
6/28/1923,1923,6,179,0,27.9,11.3,,
6/29/1923,1923,6,180,0,30.6,9.8,,
6/30/1923,1923,6,181,0,31.6,12.2,,
7/1/1923,1923,7,182,0,29.3,13.2,,
7/2/1923,1923,7,183,0,29.3,12.7,,
7/3/1923,1923,7,184,0,32,11.7,,
7/4/1923,1923,7,185,0,31.6,12.7,,
7/5/1923,1923,7,186,0,31.6,13.6,,
7/6/1923,1923,7,187,0,24.3,15.1,,
7/7/1923,1923,7,188,0,26.1,11.3,,
7/8/1923,1923,7,189,0,24.7,12.7,,
7/9/1923,1923,7,190,0,26.5,10.8,,
7/10/1923,1923,7,191,0,26.1,13.6,,
7/11/1923,1923,7,192,0,28.4,11.3,,
7/12/1923,1923,7,193,0,28.4,12.2,,
7/13/1923,1923,7,194,0,28.4,14.1,,
7/14/1923,1923,7,195,0,27.5,14.7,,
7/15/1923,1923,7,196,0,23.4,13.2,,
7/16/1923,1923,7,197,0,21.1,13.2,,
7/17/1923,1923,7,198,0,26.1,12.2,,
7/18/1923,1923,7,199,0,25.6,13.2,,
7/19/1923,1923,7,200,0,27,13.2,,
7/20/1923,1923,7,201,0,30.2,12.7,,
7/21/1923,1923,7,202,0,29.7,12.2,,
7/22/1923,1923,7,203,0,30.6,12.2,,
7/23/1923,1923,7,204,0,29.7,13.2,,
7/24/1923,1923,7,205,0,28.4,14.7,,
7/25/1923,1923,7,206,0,30.2,9.3,,
7/26/1923,1923,7,207,0,32.5,11.7,,
7/27/1923,1923,7,208,0,35.2,14.1,,
7/28/1923,1923,7,209,0,34.7,18,,
7/29/1923,1923,7,210,0,31.1,16,,
7/30/1923,1923,7,211,0,28.4,14.7,,
7/31/1923,1923,7,212,0,27.5,11.3,,
8/1/1923,1923,8,213,0.5,27,11.7,,
8/2/1923,1923,8,214,0,24.3,13.6,,
8/3/1923,1923,8,215,0,23.4,12.2,,
8/4/1923,1923,8,216,0,23.8,12.2,,
8/5/1923,1923,8,217,0,27.5,10.3,,
8/6/1923,1923,8,218,0,27.9,12.7,,
8/7/1923,1923,8,219,0,28.4,12.2,,
8/8/1923,1923,8,220,0,27.5,13.2,,
8/9/1923,1923,8,221,0,25.6,11.7,,
8/10/1923,1923,8,222,0,24.7,13.2,,
8/11/1923,1923,8,223,0,27.9,10.3,,
8/12/1923,1923,8,224,0,22,15.1,,
8/13/1923,1923,8,225,0,29.7,13.2,,
8/14/1923,1923,8,226,0,30.2,12.7,,
8/15/1923,1923,8,227,0,29.7,12.7,,
8/16/1923,1923,8,228,0,27,12.7,,
8/17/1923,1923,8,229,0,28.4,12.2,,
8/18/1923,1923,8,230,0,25.2,13.2,,
8/19/1923,1923,8,231,0,25.6,11.7,,
8/20/1923,1923,8,232,0,25.6,13.6,,
8/21/1923,1923,8,233,0,25.6,14.1,,
8/22/1923,1923,8,234,0,27.9,12.7,,
8/23/1923,1923,8,235,0,30.2,12.7,,
8/24/1923,1923,8,236,0,31.1,14.1,,
8/25/1923,1923,8,237,0,32,15.6,,
8/26/1923,1923,8,238,0,32.5,20.4,,
8/27/1923,1923,8,239,0,27.9,19.4,,
8/28/1923,1923,8,240,0,24.7,17.5,,
8/29/1923,1923,8,241,0,25.6,14.1,,
8/30/1923,1923,8,242,0,29.7,14.1,,
8/31/1923,1923,8,243,0,30.2,16,,
9/1/1923,1923,9,244,0,31.6,15.1,,
9/2/1923,1923,9,245,0,32.5,15.1,,
9/3/1923,1923,9,246,0,33.4,17,,
9/4/1923,1923,9,247,0,32.5,15.1,,
9/5/1923,1923,9,248,0,33.4,17,,
9/6/1923,1923,9,249,0,34.3,18,,
9/7/1923,1923,9,250,0,35.2,15.6,,
9/8/1923,1923,9,251,0,34.7,16,,
9/9/1923,1923,9,252,0,33.8,14.7,,
9/10/1923,1923,9,253,0,27.5,15.1,,
9/11/1923,1923,9,254,0,27,10.8,,
9/12/1923,1923,9,255,0,27.9,11.3,,
9/13/1923,1923,9,256,0,23.8,15.6,,
9/14/1923,1923,9,257,0,26.1,13.6,,
9/15/1923,1923,9,258,0,30.6,13.6,,
9/16/1923,1923,9,259,0,30.6,16,,
9/17/1923,1923,9,260,0,27.9,20.9,,
9/18/1923,1923,9,261,0,26.1,17,,
9/19/1923,1923,9,262,0,24.3,12.7,,
9/20/1923,1923,9,263,0,22,12.7,,
9/21/1923,1923,9,264,0,20.2,15.6,,
9/22/1923,1923,9,265,1.9,17,13.6,,
9/23/1923,1923,9,266,0,17,12.7,,
9/24/1923,1923,9,267,0,17.9,8.9,,
9/25/1923,1923,9,268,11.5,17.5,12.7,,
9/26/1923,1923,9,269,0,17.9,6.4,,
9/27/1923,1923,9,270,0,22,10.3,,
9/28/1923,1923,9,271,0,22.9,9.8,,
9/29/1923,1923,9,272,0,25.2,9.8,,
9/30/1923,1923,9,273,0,26.1,10.8,,
10/1/1923,1923,10,274,0,24.3,10.3,,
10/2/1923,1923,10,275,0,21.5,9.3,,
10/3/1923,1923,10,276,0,21.1,15.1,,
10/4/1923,1923,10,277,0,21.5,10.3,,
10/5/1923,1923,10,278,0,22,7.9,,
10/6/1923,1923,10,279,13.5,19.3,13.6,,
10/7/1923,1923,10,280,0,17,10.3,,
10/8/1923,1923,10,281,0,18.8,11.7,,
10/9/1923,1923,10,282,0,20.6,9.3,,
10/10/1923,1923,10,283,0,21.5,7.4,,
10/11/1923,1923,10,284,0,21.1,8.9,,
10/12/1923,1923,10,285,0,23.8,15.6,,
10/13/1923,1923,10,286,0,24.7,14.7,,
10/14/1923,1923,10,287,0,23.4,6.4,,
10/15/1923,1923,10,288,0,21.1,10.8,,
10/16/1923,1923,10,289,7.3,23.3,8.4,,
10/17/1923,1923,10,290,0,23.5,8.2,,
10/18/1923,1923,10,291,0,22.9,8,,
10/19/1923,1923,10,292,0,23.2,7.8,,
10/20/1923,1923,10,293,0,23.4,7.7,,
10/21/1923,1923,10,294,0,22.9,8.2,,
10/22/1923,1923,10,295,0,22.3,8,,
10/23/1923,1923,10,296,0,22.1,7.8,,
10/24/1923,1923,10,297,0,21.1,10.3,,
10/25/1923,1923,10,298,0,22,5.5,,
10/26/1923,1923,10,299,0,22.9,4.5,,
10/27/1923,1923,10,300,0,22.4,6.4,,
10/28/1923,1923,10,301,0,22.9,4.5,,
10/29/1923,1923,10,302,0,21.5,5.5,,
10/30/1923,1923,10,303,0,19.3,8.9,,
10/31/1923,1923,10,304,0,18.4,3.6,,
11/1/1923,1923,11,305,0,19.7,4,,
11/2/1923,1923,11,306,0,17.5,4.5,,
11/3/1923,1923,11,307,0,21.1,6,,
11/4/1923,1923,11,308,0,22,3.6,,
11/5/1923,1923,11,309,0,22,4.9,,
11/6/1923,1923,11,310,0,21.1,3.6,,
11/7/1923,1923,11,311,0,21.5,6,,
11/8/1923,1923,11,312,6.9,16.6,10.8,,
11/9/1923,1923,11,313,0,17.9,10.8,,
11/10/1923,1923,11,314,0,16.1,10.3,,
11/11/1923,1923,11,315,0,17.5,7.9,,
11/12/1923,1923,11,316,0,19.3,11.3,,
11/13/1923,1923,11,317,0,18.8,11.3,,
11/14/1923,1923,11,318,0,18.8,8.3,,
11/15/1923,1923,11,319,0,22.9,13.2,,
11/16/1923,1923,11,320,0,21.5,6,,
11/17/1923,1923,11,321,0,21.1,3,,
11/18/1923,1923,11,322,0,20.2,3,,
11/19/1923,1923,11,323,0,19.3,6,,
11/20/1923,1923,11,324,0,19.3,3.6,,
11/21/1923,1923,11,325,0,18.8,4,,
11/22/1923,1923,11,326,0,17,2.6,,
11/23/1923,1923,11,327,0,20.2,6,,
11/24/1923,1923,11,328,0,20.6,4,,
11/25/1923,1923,11,329,0,17.5,4.9,,
11/26/1923,1923,11,330,0,21.1,4.5,,
11/27/1923,1923,11,331,0,19.3,12.7,,
11/28/1923,1923,11,332,0,17.5,2.1,,
11/29/1923,1923,11,333,0,13.4,4.5,,
11/30/1923,1923,11,334,10.6,12.5,9.3,,
12/1/1923,1923,12,335,0,14.3,4.9,,
12/2/1923,1923,12,336,0,13.8,0.6,,
12/3/1923,1923,12,337,0,16.6,0.6,,
12/4/1923,1923,12,338,0,16.1,1.7,,
12/5/1923,1923,12,339,0,15.7,3,,
12/6/1923,1923,12,340,0,15.2,2.6,,
12/7/1923,1923,12,341,0,15.7,6.9,,
12/8/1923,1923,12,342,0,12.9,4,,
12/9/1923,1923,12,343,0,13.8,4,,
12/10/1923,1923,12,344,0,16.1,4.9,,
12/11/1923,1923,12,345,0,13.4,-1.3,,
12/12/1923,1923,12,346,0,12,0.6,,
12/13/1923,1923,12,347,8.5,7.5,3,,
12/14/1923,1923,12,348,12.8,13.4,4.5,,
12/15/1923,1923,12,349,0,8.9,3.6,,
12/16/1923,1923,12,350,0,9.8,6.4,,
12/17/1923,1923,12,351,0,9.8,5.5,,
12/18/1923,1923,12,352,2.1,8.4,5.5,,
12/19/1923,1923,12,353,0,12,6,,
12/20/1923,1923,12,354,0,12.5,0.6,,
12/21/1923,1923,12,355,0,12.5,-0.3,,
12/22/1923,1923,12,356,0,12.5,-0.3,,
12/23/1923,1923,12,357,0,12.5,0.2,,
12/24/1923,1923,12,358,0,12.5,1.1,,
12/25/1923,1923,12,359,7.8,10.7,1.7,,
12/26/1923,1923,12,360,0,11.1,3,,
12/27/1923,1923,12,361,0,11.6,0.6,,
12/28/1923,1923,12,362,0,13.4,-1.3,,
12/29/1923,1923,12,363,0,14.8,6.4,,
12/30/1923,1923,12,364,0,10.7,4,,
12/31/1923,1923,12,365,0,10.7,2.6,,
1/1/1924,1924,1,1,0,7.5,-2.7,,
1/2/1924,1924,1,2,0,5.2,-3.2,,
1/3/1924,1924,1,3,4.7,4.8,1.1,,
1/4/1924,1924,1,4,0,5.7,-1.7,,
1/5/1924,1924,1,5,0,8,-0.8,,
1/6/1924,1924,1,6,0,6.1,-0.8,,
1/7/1924,1924,1,7,0,5.7,2.1,,
1/8/1924,1924,1,8,1.1,11.1,2.6,,
1/9/1924,1924,1,9,0,14.3,1.7,,
1/10/1924,1924,1,10,0,13.8,-0.8,,
1/11/1924,1924,1,11,0,14.3,-1.3,,
1/12/1924,1924,1,12,0,12.9,-2.2,,
1/13/1924,1924,1,13,0,14.3,-1.3,,
1/14/1924,1924,1,14,0,16.1,6,,
1/15/1924,1924,1,15,0,16.6,4.9,,
1/16/1924,1924,1,16,0,16.1,1.1,,
1/17/1924,1924,1,17,0,13.8,-1.3,,
1/18/1924,1924,1,18,0,14.8,1.1,,
1/19/1924,1924,1,19,0,14.3,-1.3,,
1/20/1924,1924,1,20,0,15.2,-1.7,,
1/21/1924,1924,1,21,0,15.7,-1.7,,
1/22/1924,1924,1,22,0,15.2,-1.7,,
1/23/1924,1924,1,23,0,16.6,-0.3,,
1/24/1924,1924,1,24,0,16.1,-1.3,,
1/25/1924,1924,1,25,0,14.3,2.1,,
1/26/1924,1924,1,26,28,13.4,6.9,,
1/27/1924,1924,1,27,12.7,12,10.3,,
1/28/1924,1924,1,28,0,13.4,4.9,,
1/29/1924,1924,1,29,0,14.8,6.4,,
1/30/1924,1924,1,30,0,13.4,4.9,,
1/31/1924,1924,1,31,0,11.6,8.9,,
2/1/1924,1924,2,32,0,15.2,7.9,,
2/2/1924,1924,2,33,0,13.8,4.5,,
2/3/1924,1924,2,34,0,15.2,3,,
2/4/1924,1924,2,35,0,17.5,4,,
2/5/1924,1924,2,36,1.8,12,7.9,,
2/6/1924,1924,2,37,7.5,12.5,10.3,,
2/7/1924,1924,2,38,9.9,14.3,12.2,,
2/8/1924,1924,2,39,13.7,14.3,10.3,,
2/9/1924,1924,2,40,0,17.5,8.3,,
2/10/1924,1924,2,41,0,17,4,,
2/11/1924,1924,2,42,0,17.5,5.5,,
2/12/1924,1924,2,43,0,18.8,5.5,,
2/13/1924,1924,2,44,0,19.3,4.5,,
2/14/1924,1924,2,45,0,18.4,4.9,,
2/15/1924,1924,2,46,0,14.8,7.9,,
2/16/1924,1924,2,47,0,17.5,7.9,,
2/17/1924,1924,2,48,0,19.3,6.4,,
2/18/1924,1924,2,49,0,20.2,4.5,,
2/19/1924,1924,2,50,0,19.7,6,,
2/20/1924,1924,2,51,0,18.4,6.4,,
2/21/1924,1924,2,52,0,20.2,8.3,,
2/22/1924,1924,2,53,0,18.8,5.5,,
2/23/1924,1924,2,54,0,18.8,6.4,,
2/24/1924,1924,2,55,0,20.6,9.8,,
2/25/1924,1924,2,56,0,18.8,3.6,,
2/26/1924,1924,2,57,0,19.3,7.9,,
2/27/1924,1924,2,58,0,20.6,8.3,,
2/28/1924,1924,2,59,0,21.5,6.9,,
2/29/1924,1924,2,60,0,21.1,6,,
3/1/1924,1924,3,61,0,16.1,8.9,,
3/2/1924,1924,3,62,10.3,13.8,9.8,,
3/3/1924,1924,3,63,0,16.6,7.9,,
3/4/1924,1924,3,64,0,17.9,7.4,,
3/5/1924,1924,3,65,0,20.6,7.9,,
3/6/1924,1924,3,66,0,19.7,3.6,,
3/7/1924,1924,3,67,0,17.9,7.9,,
3/8/1924,1924,3,68,0,19.7,7.4,,
3/9/1924,1924,3,69,0,18.8,6.4,,
3/10/1924,1924,3,70,0,19.3,3.6,,
3/11/1924,1924,3,71,0,18.8,9.3,,
3/12/1924,1924,3,72,0,20.6,7.4,,
3/13/1924,1924,3,73,0,21.5,2.1,,
3/14/1924,1924,3,74,0,22.4,9.8,,
3/15/1924,1924,3,75,0,17.5,8.9,,
3/16/1924,1924,3,76,0,18.8,7.9,,
3/17/1924,1924,3,77,0,17.5,6,,
3/18/1924,1924,3,78,0,18.8,8.9,,
3/19/1924,1924,3,79,0,21.1,1.7,,
3/20/1924,1924,3,80,4.4,16.1,8.9,,
3/21/1924,1924,3,81,0,16.6,1.1,,
3/22/1924,1924,3,82,2.9,10.2,3,,
3/23/1924,1924,3,83,1.8,13.8,3.6,,
3/24/1924,1924,3,84,6.3,11.6,4.5,,
3/25/1924,1924,3,85,11.8,8.4,3.6,,
3/26/1924,1924,3,86,5.9,12.9,5.5,,
3/27/1924,1924,3,87,0,15.7,3,,
3/28/1924,1924,3,88,0,16.6,3.6,,
3/29/1924,1924,3,89,0,16.6,3,,
3/30/1924,1924,3,90,0,17.5,2.6,,
3/31/1924,1924,3,91,0,16.1,7.9,,
4/1/1924,1924,4,92,0,15.2,8.9,,
4/2/1924,1924,4,93,0,18.4,4.5,,
4/3/1924,1924,4,94,5.7,13.8,9.8,,
4/4/1924,1924,4,95,0,17,6.9,,
4/5/1924,1924,4,96,0,24.3,11.3,,
4/6/1924,1924,4,97,0,27.5,14.7,,
4/7/1924,1924,4,98,0,25.2,6,,
4/8/1924,1924,4,99,0,24.3,13.2,,
4/9/1924,1924,4,100,0,25.6,8.3,,
4/10/1924,1924,4,101,0,24.7,6.9,,
4/11/1924,1924,4,102,0,23.8,6.9,,
4/12/1924,1924,4,103,0,23.4,7.9,,
4/13/1924,1924,4,104,0,15.2,9.8,,
4/14/1924,1924,4,105,0,17.5,7.4,,
4/15/1924,1924,4,106,0,16.1,4.9,,
4/16/1924,1924,4,107,0,19.3,6.9,,
4/17/1924,1924,4,108,0,23.8,7.9,,
4/18/1924,1924,4,109,0,25.2,5.5,,
4/19/1924,1924,4,110,0,26.5,8.3,,
4/20/1924,1924,4,111,0,23.8,8.3,,
4/21/1924,1924,4,112,0,22.9,6.4,,
4/22/1924,1924,4,113,0,20.6,5.5,,
4/23/1924,1924,4,114,0.9,14.3,10.3,,
4/24/1924,1924,4,115,0,22.4,4,,
4/25/1924,1924,4,116,0,23.4,8.9,,
4/26/1924,1924,4,117,0,23.4,4.9,,
4/27/1924,1924,4,118,0,18.4,10.3,,
4/28/1924,1924,4,119,0,20.6,7.4,,
4/29/1924,1924,4,120,0,23.8,6.9,,
4/30/1924,1924,4,121,0,26.1,6.9,,
5/1/1924,1924,5,122,0,26.5,7.9,,
5/2/1924,1924,5,123,0,25.6,7.9,,
5/3/1924,1924,5,124,0,22,7.9,,
5/4/1924,1924,5,125,0,19.3,6.4,,
5/5/1924,1924,5,126,0,19.7,10.8,,
5/6/1924,1924,5,127,0,25.2,7.4,,
5/7/1924,1924,5,128,0,28.4,8.9,,
5/8/1924,1924,5,129,0,29.3,9.3,,
5/9/1924,1924,5,130,0,25.2,8.9,,
5/10/1924,1924,5,131,0,24.3,11.3,,
5/11/1924,1924,5,132,0,22,10.3,,
5/12/1924,1924,5,133,2,15.2,12.7,,
5/13/1924,1924,5,134,0,20.6,6.4,,
5/14/1924,1924,5,135,0,27,10.8,,
5/15/1924,1924,5,136,0,30.6,12.7,,
5/16/1924,1924,5,137,0,31.1,13.2,,
5/17/1924,1924,5,138,0,25.6,8.9,,
5/18/1924,1924,5,139,0,28.4,9.3,,
5/19/1924,1924,5,140,0,24.7,10.8,,
5/20/1924,1924,5,141,0,23.4,11.3,,
5/21/1924,1924,5,142,0,21.1,9.3,,
5/22/1924,1924,5,143,0,22.9,8.3,,
5/23/1924,1924,5,144,0,22.9,10.3,,
5/24/1924,1924,5,145,0,22.4,12.2,,
5/25/1924,1924,5,146,0,24.3,10.3,,
5/26/1924,1924,5,147,0,27,9.3,,
5/27/1924,1924,5,148,0,27.5,15.1,,
5/28/1924,1924,5,149,0,29.7,22.8,,
5/29/1924,1924,5,150,0,28.8,22.3,,
5/30/1924,1924,5,151,0,31.6,17.5,,
5/31/1924,1924,5,152,0,32,11.7,,
6/1/1924,1924,6,153,0,32.5,12.2,,
6/2/1924,1924,6,154,0,32.9,14.7,,
6/3/1924,1924,6,155,0,30.2,13.2,,
6/4/1924,1924,6,156,0,27,12.2,,
6/5/1924,1924,6,157,0,24.7,11.7,,
6/6/1924,1924,6,158,0,25.2,11.3,,
6/7/1924,1924,6,159,0,24.7,17,,
6/8/1924,1924,6,160,0,24.7,10.3,,
6/9/1924,1924,6,161,0,18.4,11.3,,
6/10/1924,1924,6,162,0,23.8,10.3,,
6/11/1924,1924,6,163,0,22.4,13.2,,
6/12/1924,1924,6,164,0,24.3,11.7,,
6/13/1924,1924,6,165,0,22.9,11.7,,
6/14/1924,1924,6,166,0,23.4,9.8,,
6/15/1924,1924,6,167,0,24.7,9.8,,
6/16/1924,1924,6,168,0,23.4,11.7,,
6/17/1924,1924,6,169,0,23.8,9.8,,
6/18/1924,1924,6,170,0,23.8,9.8,,
6/19/1924,1924,6,171,0,27,15.6,,
6/20/1924,1924,6,172,0,32.9,14.1,,
6/21/1924,1924,6,173,0,31.6,15.6,,
6/22/1924,1924,6,174,0,29.3,13.2,,
6/23/1924,1924,6,175,0,28.4,12.7,,
6/24/1924,1924,6,176,0,27.9,11.7,,
6/25/1924,1924,6,177,0,27.9,12.2,,
6/26/1924,1924,6,178,0,27.9,13.2,,
6/27/1924,1924,6,179,0,29.7,10.8,,
6/28/1924,1924,6,180,0,32.9,11.7,,
6/29/1924,1924,6,181,0,33.4,13.2,,
6/30/1924,1924,6,182,0,32,15.6,,
7/1/1924,1924,7,183,1,31.1,14.7,,
7/2/1924,1924,7,184,0,32.9,20.9,,
7/3/1924,1924,7,185,0,29.7,15.1,,
7/4/1924,1924,7,186,0,22.9,13.6,,
7/5/1924,1924,7,187,0,26.1,12.2,,
7/6/1924,1924,7,188,0,28.8,13.2,,
7/7/1924,1924,7,189,0,28.4,10.8,,
7/8/1924,1924,7,190,0,28.4,13.2,,
7/9/1924,1924,7,191,0,28.8,13.2,,
7/10/1924,1924,7,192,0,28.4,12.2,,
7/11/1924,1924,7,193,0,25.2,13.2,,
7/12/1924,1924,7,194,0,24.3,10.3,,
7/13/1924,1924,7,195,0,27.9,9.3,,
7/14/1924,1924,7,196,0,26.5,14.7,,
7/15/1924,1924,7,197,0,27.5,10.8,,
7/16/1924,1924,7,198,0,28.4,11.3,,
7/17/1924,1924,7,199,0,28.4,10.8,,
7/18/1924,1924,7,200,0,29.3,11.3,,
7/19/1924,1924,7,201,0,27.5,14.7,,
7/20/1924,1924,7,202,0,27.5,13.2,,
7/21/1924,1924,7,203,0,27.5,16,,
7/22/1924,1924,7,204,0,27,14.7,,
7/23/1924,1924,7,205,0,24.7,13.2,,
7/24/1924,1924,7,206,0,26.5,13.6,,
7/25/1924,1924,7,207,0,27.5,13.6,,
7/26/1924,1924,7,208,0,28.8,11.3,,
7/27/1924,1924,7,209,0,26.5,12.7,,
7/28/1924,1924,7,210,0,23.4,10.8,,
7/29/1924,1924,7,211,0,23.4,12.7,,
7/30/1924,1924,7,212,0,27.9,10.8,,
7/31/1924,1924,7,213,0,28.8,10.8,,
8/1/1924,1924,8,214,0,26.5,14.1,,
8/2/1924,1924,8,215,0,23.8,13.6,,
8/3/1924,1924,8,216,0,28.4,9.8,,
8/4/1924,1924,8,217,0,28.4,13.2,,
8/5/1924,1924,8,218,0,27.5,13.6,,
8/6/1924,1924,8,219,0,28.4,10.8,,
8/7/1924,1924,8,220,0,28.4,11.7,,
8/8/1924,1924,8,221,0,25.2,13.6,,
8/9/1924,1924,8,222,0,23.4,11.3,,
8/10/1924,1924,8,223,0,29.3,11.3,,
8/11/1924,1924,8,224,0,31.1,12.7,,
8/12/1924,1924,8,225,0,28.8,10.8,,
8/13/1924,1924,8,226,0,25.2,10.8,,
8/14/1924,1924,8,227,0,28.8,11.7,,
8/15/1924,1924,8,228,0,24.3,12.2,,
8/16/1924,1924,8,229,0,22,13.2,,
8/17/1924,1924,8,230,0,20.6,13.2,,
8/18/1924,1924,8,231,0,23.4,10.8,,
8/19/1924,1924,8,232,0,24.3,14.1,,
8/20/1924,1924,8,233,0,26.5,12.2,,
8/21/1924,1924,8,234,0,27,14.1,,
8/22/1924,1924,8,235,0,23.8,13.6,,
8/23/1924,1924,8,236,0,27.9,12.7,,
8/24/1924,1924,8,237,0,30.6,12.2,,
8/25/1924,1924,8,238,0,32.9,12.7,,
8/26/1924,1924,8,239,0,33.4,14.1,,
8/27/1924,1924,8,240,0,32,14.7,,
8/28/1924,1924,8,241,0,30.2,13.6,,
8/29/1924,1924,8,242,0,29.3,13.6,,
8/30/1924,1924,8,243,0,30.6,15.6,,
8/31/1924,1924,8,244,0,30.6,13.6,,
9/1/1924,1924,9,245,0,25.6,17.5,,
9/2/1924,1924,9,246,0,22.9,12.7,,
9/3/1924,1924,9,247,0,27.5,8.3,,
9/4/1924,1924,9,248,0,29.7,11.3,,
9/5/1924,1924,9,249,0,30.6,11.7,,
9/6/1924,1924,9,250,0,32,11.3,,
9/7/1924,1924,9,251,0,19.3,14.7,,
9/8/1924,1924,9,252,0,25.2,10.3,,
9/9/1924,1924,9,253,0,27.5,11.3,,
9/10/1924,1924,9,254,0,28.4,14.1,,
9/11/1924,1924,9,255,0,29.7,18,,
9/12/1924,1924,9,256,0,28.8,11.7,,
9/13/1924,1924,9,257,0,27.5,14.1,,
9/14/1924,1924,9,258,0,27.5,14.1,,
9/15/1924,1924,9,259,0,24.3,14.1,,
9/16/1924,1924,9,260,0,24.3,10.8,,
9/17/1924,1924,9,261,0,24.7,7.4,,
9/18/1924,1924,9,262,0,27.9,9.3,,
9/19/1924,1924,9,263,0,21.5,14.1,,
9/20/1924,1924,9,264,0,22,13.6,,
9/21/1924,1924,9,265,0,25.2,5.5,,
9/22/1924,1924,9,266,0,25.2,7.9,,
9/23/1924,1924,9,267,0,23.8,8.3,,
9/24/1924,1924,9,268,0,22.4,11.7,,
9/25/1924,1924,9,269,0,20.6,10.8,,
9/26/1924,1924,9,270,0,24.3,16.6,,
9/27/1924,1924,9,271,0,27,7.9,,
9/28/1924,1924,9,272,0,28.4,9.3,,
9/29/1924,1924,9,273,0,26.5,8.3,,
9/30/1924,1924,9,274,0,25.6,10.8,,
10/1/1924,1924,10,275,0,27,10.3,,
10/2/1924,1924,10,276,0,28.8,19,,
10/3/1924,1924,10,277,0,29.7,11.7,,
10/4/1924,1924,10,278,0,25.2,16,,
10/5/1924,1924,10,279,19.8,14.8,11.7,,
10/6/1924,1924,10,280,5.6,18.8,11.3,,
10/7/1924,1924,10,281,0,20.6,8.3,,
10/8/1924,1924,10,282,0,18.8,9.3,,
10/9/1924,1924,10,283,0,18.4,8.9,,
10/10/1924,1924,10,284,0,15.2,9.3,,
10/11/1924,1924,10,285,0,17.9,4,,
10/12/1924,1924,10,286,0,19.3,3.6,,
10/13/1924,1924,10,287,0,21.5,7.4,,
10/14/1924,1924,10,288,0,20.2,7.4,,
10/15/1924,1924,10,289,0,19.7,8.3,,
10/16/1924,1924,10,290,9.8,15.2,12.2,,
10/17/1924,1924,10,291,0,18.8,7.4,,
10/18/1924,1924,10,292,0,20.6,8.3,,
10/19/1924,1924,10,293,0,22,8.9,,
10/20/1924,1924,10,294,0,21.1,10.3,,
10/21/1924,1924,10,295,0,19.7,8.9,,
10/22/1924,1924,10,296,0,21.1,12.2,,
10/23/1924,1924,10,297,0,21.1,11.7,,
10/24/1924,1924,10,298,0,22.4,8.3,,
10/25/1924,1924,10,299,0,21.1,7.4,,
10/26/1924,1924,10,300,0,19.3,8.3,,
10/27/1924,1924,10,301,9.3,16.6,12.2,,
10/28/1924,1924,10,302,3.3,15.7,13.6,,
10/29/1924,1924,10,303,0,14.8,9.3,,
10/30/1924,1924,10,304,0,14.8,4,,
10/31/1924,1924,10,305,0,18.8,4.9,,
11/1/1924,1924,11,306,0,20.6,7.4,,
11/2/1924,1924,11,307,0,20.6,7.4,,
11/3/1924,1924,11,308,0,21.1,7.4,,
11/4/1924,1924,11,309,3.4,17.5,13.2,,
11/5/1924,1924,11,310,0,15.2,7.4,,
11/6/1924,1924,11,311,0,14.3,0.6,,
11/7/1924,1924,11,312,0,13.4,2.6,,
11/8/1924,1924,11,313,5,12.5,11.3,,
11/9/1924,1924,11,314,39.3,15.7,12.2,,
11/10/1924,1924,11,315,0,12.5,3,,
11/11/1924,1924,11,316,0,12.9,0.6,,
11/12/1924,1924,11,317,0,12,1.7,,
11/13/1924,1924,11,318,0,11.1,2.6,,
11/14/1924,1924,11,319,0,13.4,3.6,,
11/15/1924,1924,11,320,0,15.7,3,,
11/16/1924,1924,11,321,0,15.7,4,,
11/17/1924,1924,11,322,0,19.7,8.9,,
11/18/1924,1924,11,323,0,13.4,4,,
11/19/1924,1924,11,324,0,16.6,6,,
11/20/1924,1924,11,325,0,20.2,8.9,,
11/21/1924,1924,11,326,0,16.1,7.9,,
11/22/1924,1924,11,327,0,19.3,8.3,,
11/23/1924,1924,11,328,0,16.6,12.7,,
11/24/1924,1924,11,329,0,15.2,3.6,,
11/25/1924,1924,11,330,0,17.5,3.6,,
11/26/1924,1924,11,331,0,17.9,2.1,,
11/27/1924,1924,11,332,0,18.4,1.7,,
11/28/1924,1924,11,333,0,18.4,1.7,,
11/29/1924,1924,11,334,0,18.8,1.7,,
11/30/1924,1924,11,335,0,16.6,3.6,,
12/1/1924,1924,12,336,0,15.7,6.9,,
12/2/1924,1924,12,337,1.8,15.2,4,,
12/3/1924,1924,12,338,0,13.8,2.1,,
12/4/1924,1924,12,339,6.4,8.9,3.6,,
12/5/1924,1924,12,340,16.6,8.9,4,,
12/6/1924,1924,12,341,10,10.7,1.7,,
12/7/1924,1924,12,342,6.1,8.9,7.4,,
12/8/1924,1924,12,343,12.1,11.1,7.9,,
12/9/1924,1924,12,344,0,13.8,4,,
12/10/1924,1924,12,345,0,11.6,4.9,,
12/11/1924,1924,12,346,0,10.7,7.9,,
12/12/1924,1924,12,347,0,10.7,7.4,,
12/13/1924,1924,12,348,0,11.1,6,,
12/14/1924,1924,12,349,1.8,8.9,6.9,,
12/15/1924,1924,12,350,0,8.4,4,,
12/16/1924,1924,12,351,0,10.2,4,,
12/17/1924,1924,12,352,0,8.4,-1.3,,
12/18/1924,1924,12,353,0,7.5,-1.3,,
12/19/1924,1924,12,354,0,6.6,-2.2,,
12/20/1924,1924,12,355,0,8.4,-0.3,,
12/21/1924,1924,12,356,30.3,10.2,3.6,,
12/22/1924,1924,12,357,6.1,10.7,4.9,,
12/23/1924,1924,12,358,0,8.4,2.6,,
12/24/1924,1924,12,359,0,9.3,2.1,,
12/25/1924,1924,12,360,0,9.3,-0.8,,
12/26/1924,1924,12,361,0,9.8,-3.7,,
12/27/1924,1924,12,362,0,8,2.1,,
12/28/1924,1924,12,363,4.2,10.7,6.4,,
12/29/1924,1924,12,364,6.7,10.7,2.6,,
12/30/1924,1924,12,365,5.4,11.6,10.3,,
12/31/1924,1924,12,366,0,11.6,8.9,,
1/1/1925,1925,1,1,0,12.9,4.9,,
1/2/1925,1925,1,2,0,11.6,3.6,,
1/3/1925,1925,1,3,0,11.1,2.6,,
1/4/1925,1925,1,4,0,6.6,1.1,,
1/5/1925,1925,1,5,0,8.4,4,,
1/6/1925,1925,1,6,0,11.1,5.5,,
1/7/1925,1925,1,7,0,11.6,4,,
1/8/1925,1925,1,8,0,11.1,1.1,,
1/9/1925,1925,1,9,0,12,-0.3,,
1/10/1925,1925,1,10,0,12,0.2,,
1/11/1925,1925,1,11,0,12,1.7,,
1/12/1925,1925,1,12,0,12.9,-1.3,,
1/13/1925,1925,1,13,0,12.5,-0.3,,
1/14/1925,1925,1,14,4.2,11.6,6.4,,
1/15/1925,1925,1,15,0,12.5,3.6,,
1/16/1925,1925,1,16,0,9.8,-0.3,,
1/17/1925,1925,1,17,0,12.9,0.6,,
1/18/1925,1925,1,18,0,12.5,2.6,,
1/19/1925,1925,1,19,0,17,4,,
1/20/1925,1925,1,20,0,14.8,2.1,,
1/21/1925,1925,1,21,0,16.6,1.7,,
1/22/1925,1925,1,22,0,18.8,6.4,,
1/23/1925,1925,1,23,0,17,7.9,,
1/24/1925,1925,1,24,2.4,12.9,9.3,,
1/25/1925,1925,1,25,27.9,12.5,9.8,,
1/26/1925,1925,1,26,0,15.7,10.3,,
1/27/1925,1925,1,27,0,15.2,10.3,,
1/28/1925,1925,1,28,0,16.1,8.9,,
1/29/1925,1925,1,29,0,12.5,8.3,,
1/30/1925,1925,1,30,2.1,16.1,10.3,,
1/31/1925,1925,1,31,0,13.8,6.9,,
2/1/1925,1925,2,32,0,12,7.4,,
2/2/1925,1925,2,33,0,14.8,9.8,,
2/3/1925,1925,2,34,7.7,13.4,7.9,,
2/4/1925,1925,2,35,11.6,14.3,11.7,,
2/5/1925,1925,2,36,9.2,14.3,8.9,,
2/6/1925,1925,2,37,8.9,15.7,10.3,,
2/7/1925,1925,2,38,1.2,13.4,8.3,,
2/8/1925,1925,2,39,17.2,15.2,9.8,,
2/9/1925,1925,2,40,0,9.3,4,,
2/10/1925,1925,2,41,0,14.8,4.9,,
2/11/1925,1925,2,42,13.1,14.3,8.9,,
2/12/1925,1925,2,43,11,14.3,8.3,,
2/13/1925,1925,2,44,8.3,15.7,7.9,,
2/14/1925,1925,2,45,0,12.5,4,,
2/15/1925,1925,2,46,0,14.3,6,,
2/16/1925,1925,2,47,0,13.8,8.3,,
2/17/1925,1925,2,48,0,16.6,6.4,,
2/18/1925,1925,2,49,0,17.5,3.6,,
2/19/1925,1925,2,50,0,17.9,4,,
2/20/1925,1925,2,51,10.1,15.2,10.8,,
2/21/1925,1925,2,52,0.6,12.9,7.9,,
2/22/1925,1925,2,53,3.6,12.9,8.9,,
2/23/1925,1925,2,54,24.6,14.8,6.4,,
2/24/1925,1925,2,55,0,15.7,3.6,,
2/25/1925,1925,2,56,0,17,3.6,,
2/26/1925,1925,2,57,0,19.7,7.9,,
2/27/1925,1925,2,58,0,19.3,4.9,,
2/28/1925,1925,2,59,0,20.2,10.8,,
3/1/1925,1925,3,60,0,20.2,6.9,,
3/2/1925,1925,3,61,0,19.3,8.9,,
3/3/1925,1925,3,62,0,20.2,7.4,,
3/4/1925,1925,3,63,0,20.2,6.9,,
3/5/1925,1925,3,64,0,12.9,10.8,,
3/6/1925,1925,3,65,0,12.9,3,,
3/7/1925,1925,3,66,0,11.6,2.1,,
3/8/1925,1925,3,67,0,13.8,6.9,,
3/9/1925,1925,3,68,0,12,3,,
3/10/1925,1925,3,69,0,13.8,2.1,,
3/11/1925,1925,3,70,0,14.3,2.6,,
3/12/1925,1925,3,71,0,16.1,2.6,,
3/13/1925,1925,3,72,0,18.4,3.6,,
3/14/1925,1925,3,73,0,18.8,3,,
3/15/1925,1925,3,74,0,19.7,6.4,,
3/16/1925,1925,3,75,0,20.6,6.9,,
3/17/1925,1925,3,76,0,18.8,6.4,,
3/18/1925,1925,3,77,0,21.1,3.6,,
3/19/1925,1925,3,78,0,22,5.5,,
3/20/1925,1925,3,79,0,22,11.7,,
3/21/1925,1925,3,80,0,24.7,10.8,,
3/22/1925,1925,3,81,0,22.9,7.4,,
3/23/1925,1925,3,82,0,23.4,10.3,,
3/24/1925,1925,3,83,0,26.1,8.9,,
3/25/1925,1925,3,84,0,22.4,8.9,,
3/26/1925,1925,3,85,0,22.9,6.9,,
3/27/1925,1925,3,86,0,14.8,11.7,,
3/28/1925,1925,3,87,0.4,13.8,9.3,,
3/29/1925,1925,3,88,3.9,13.4,7.9,,
3/30/1925,1925,3,89,2.4,10.7,7.4,,
3/31/1925,1925,3,90,26.8,11.6,7.9,,
4/1/1925,1925,4,91,0,15.2,2.6,,
4/2/1925,1925,4,92,0,15.7,6.9,,
4/3/1925,1925,4,93,6.9,17,10.8,,
4/4/1925,1925,4,94,47.6,11.6,9.3,,
4/5/1925,1925,4,95,0,15.2,9.8,,
4/6/1925,1925,4,96,0,16.6,10.3,,
4/7/1925,1925,4,97,0,17.5,6.9,,
4/8/1925,1925,4,98,0,20.6,6.9,,
4/9/1925,1925,4,99,0,19.3,10.3,,
4/10/1925,1925,4,100,3.1,17.9,6.9,,
4/11/1925,1925,4,101,6.3,20.6,12.7,,
4/12/1925,1925,4,102,0,22,10.3,,
4/13/1925,1925,4,103,0,24.3,10.3,,
4/14/1925,1925,4,104,0,24.7,11.3,,
4/15/1925,1925,4,105,0,23.8,16,,
4/16/1925,1925,4,106,0,19.3,12.7,,
4/17/1925,1925,4,107,3.4,15.7,9.8,,
4/18/1925,1925,4,108,0,14.3,8.3,,
4/19/1925,1925,4,109,0,17.9,11.3,,
4/20/1925,1925,4,110,0,14.8,9.3,,
4/21/1925,1925,4,111,0,19.3,3.6,,
4/22/1925,1925,4,112,0,17,6.4,,
4/23/1925,1925,4,113,0,18.4,5.5,,
4/24/1925,1925,4,114,0,21.1,6,,
4/25/1925,1925,4,115,0,24.3,8.9,,
4/26/1925,1925,4,116,0,26.1,8.9,,
4/27/1925,1925,4,117,0,26.5,8.3,,
4/28/1925,1925,4,118,0,24.7,8.3,,
4/29/1925,1925,4,119,0,17.9,9.3,,
4/30/1925,1925,4,120,0,20.2,6.9,,
5/1/1925,1925,5,121,0,26.1,7.4,,
5/2/1925,1925,5,122,0,26.5,9.3,,
5/3/1925,1925,5,123,0,28.8,11.3,,
5/4/1925,1925,5,124,0,27.5,9.3,,
5/5/1925,1925,5,125,0,26.5,9.3,,
5/6/1925,1925,5,126,0,25.2,8.9,,
5/7/1925,1925,5,127,0,23.8,9.3,,
5/8/1925,1925,5,128,0,21.5,6.4,,
5/9/1925,1925,5,129,0,17.9,8.9,,
5/10/1925,1925,5,130,0,17.5,10.8,,
5/11/1925,1925,5,131,2.8,19.7,11.3,,
5/12/1925,1925,5,132,29.6,14.3,12.2,,
5/13/1925,1925,5,133,7.7,18.8,12.2,,
5/14/1925,1925,5,134,0,22.4,10.3,,
5/15/1925,1925,5,135,0,20.6,12.2,,
5/16/1925,1925,5,136,0,20.2,12.7,,
5/17/1925,1925,5,137,0,18.8,13.2,,
5/18/1925,1925,5,138,4.9,21.1,12.7,,
5/19/1925,1925,5,139,3.2,20.2,12.2,,
5/20/1925,1925,5,140,8.1,20.2,14.7,,
5/21/1925,1925,5,141,0,23.8,10.8,,
5/22/1925,1925,5,142,0,24.7,11.3,,
5/23/1925,1925,5,143,0,22.9,12.7,,
5/24/1925,1925,5,144,0,27,9.3,,
5/25/1925,1925,5,145,0,29.7,11.3,,
5/26/1925,1925,5,146,0,27,14.1,,
5/27/1925,1925,5,147,0,24.7,11.3,,
5/28/1925,1925,5,148,0,21.1,10.8,,
5/29/1925,1925,5,149,0,22,11.7,,
5/30/1925,1925,5,150,0,17.9,8.9,,
5/31/1925,1925,5,151,1.1,21.1,11.7,,
6/1/1925,1925,6,152,0,18.4,13.2,,
6/2/1925,1925,6,153,0,18.8,12.7,,
6/3/1925,1925,6,154,0,19.3,12.7,,
6/4/1925,1925,6,155,0,21.1,9.3,,
6/5/1925,1925,6,156,0,21.5,12.2,,
6/6/1925,1925,6,157,0,24.3,9.3,,
6/7/1925,1925,6,158,0,25.2,10.8,,
6/8/1925,1925,6,159,0,25.2,12.7,,
6/9/1925,1925,6,160,0,24.7,10.8,,
6/10/1925,1925,6,161,0,26.5,8.9,,
6/11/1925,1925,6,162,0,28.8,10.8,,
6/12/1925,1925,6,163,0,28.8,13.2,,
6/13/1925,1925,6,164,0,29.3,15.1,,
6/14/1925,1925,6,165,0,23.8,11.7,,
6/15/1925,1925,6,166,0,26.1,9.8,,
6/16/1925,1925,6,167,0,25.6,14.1,,
6/17/1925,1925,6,168,0,29.3,10.8,,
6/18/1925,1925,6,169,0,30.2,13.2,,
6/19/1925,1925,6,170,0,30.6,13.6,,
6/20/1925,1925,6,171,0,33.4,17,,
6/21/1925,1925,6,172,0,25.2,14.7,,
6/22/1925,1925,6,173,0,31.1,13.2,,
6/23/1925,1925,6,174,0,33.4,13.2,,
6/24/1925,1925,6,175,0,37,18,,
6/25/1925,1925,6,176,0,37.9,20,,
6/26/1925,1925,6,177,0,36.6,21.3,,
6/27/1925,1925,6,178,0,31.6,14.7,,
6/28/1925,1925,6,179,0,22.9,14.1,,
6/29/1925,1925,6,180,0,26.5,12.7,,
6/30/1925,1925,6,181,0,31.1,10.8,,
7/1/1925,1925,7,182,1,31.1,13.6,,
7/2/1925,1925,7,183,0,25.2,15.6,,
7/3/1925,1925,7,184,0,29.7,12.7,,
7/4/1925,1925,7,185,0,24.7,15.1,,
7/5/1925,1925,7,186,0,27,13.6,,
7/6/1925,1925,7,187,0,27,12.7,,
7/7/1925,1925,7,188,0,28.8,13.6,,
7/8/1925,1925,7,189,0,27.5,12.7,,
7/9/1925,1925,7,190,0,27.9,13.2,,
7/10/1925,1925,7,191,0,27,13.2,,
7/11/1925,1925,7,192,0,28.4,12.7,,
7/12/1925,1925,7,193,0,28.4,13.2,,
7/13/1925,1925,7,194,0,30.2,12.2,,
7/14/1925,1925,7,195,0,32,14.1,,
7/15/1925,1925,7,196,0,31.6,18.5,,
7/16/1925,1925,7,197,0,34.7,18.5,,
7/17/1925,1925,7,198,0,36.6,20.9,,
7/18/1925,1925,7,199,0,32.9,21.3,,
7/19/1925,1925,7,200,0,29.7,21.3,,
7/20/1925,1925,7,201,0,28.4,19.4,,
7/21/1925,1925,7,202,0,24.3,15.6,,
7/22/1925,1925,7,203,0,21.5,13.2,,
7/23/1925,1925,7,204,0,23.4,13.2,,
7/24/1925,1925,7,205,0,23.4,11.7,,
7/25/1925,1925,7,206,0,27.9,8.9,,
7/26/1925,1925,7,207,0,30.2,10.3,,
7/27/1925,1925,7,208,0,28.8,11.7,,
7/28/1925,1925,7,209,0,29.7,10.8,,
7/29/1925,1925,7,210,0,31.1,13.2,,
7/30/1925,1925,7,211,0,30.6,13.6,,
7/31/1925,1925,7,212,0,29.3,14.7,,
8/1/1925,1925,8,213,0,27.5,15.6,,
8/2/1925,1925,8,214,0,28.8,15.6,,
8/3/1925,1925,8,215,0,30.2,9.8,,
8/4/1925,1925,8,216,0,30.6,10.3,,
8/5/1925,1925,8,217,0,30.2,10.3,,
8/6/1925,1925,8,218,0,28.4,11.7,,
8/7/1925,1925,8,219,0,27,13.6,,
8/8/1925,1925,8,220,0,25.2,14.1,,
8/9/1925,1925,8,221,0,24.3,12.7,,
8/10/1925,1925,8,222,0,27,15.1,,
8/11/1925,1925,8,223,0,17.5,16.6,,
8/12/1925,1925,8,224,0,27.5,14.1,,
8/13/1925,1925,8,225,0,24.7,14.1,,
8/14/1925,1925,8,226,0,27,11.7,,
8/15/1925,1925,8,227,0,28.8,11.7,,
8/16/1925,1925,8,228,0,23.4,12.2,,
8/17/1925,1925,8,229,0,22,13.2,,
8/18/1925,1925,8,230,0,23.8,11.7,,
8/19/1925,1925,8,231,0,25.2,8.9,,
8/20/1925,1925,8,232,0,25.6,11.3,,
8/21/1925,1925,8,233,0,24.3,10.3,,
8/22/1925,1925,8,234,0,20.6,13.6,,
8/23/1925,1925,8,235,0,22.9,11.7,,
8/24/1925,1925,8,236,0,27.5,14.1,,
8/25/1925,1925,8,237,0,30.2,8.9,,
8/26/1925,1925,8,238,0,28.4,14.7,,
8/27/1925,1925,8,239,0,23.8,14.1,,
8/28/1925,1925,8,240,0,26.5,8.9,,
8/29/1925,1925,8,241,0,25.6,13.2,,
8/30/1925,1925,8,242,0,26.5,11.3,,
8/31/1925,1925,8,243,0,23.8,12.7,,
9/1/1925,1925,9,244,0,22,12.7,,
9/2/1925,1925,9,245,0,24.7,10.3,,
9/3/1925,1925,9,246,0,22.9,13.2,,
9/4/1925,1925,9,247,0,22.9,13.2,,
9/5/1925,1925,9,248,0,23.4,11.7,,
9/6/1925,1925,9,249,0.5,19.7,16.6,,
9/7/1925,1925,9,250,0,21.1,16.6,,
9/8/1925,1925,9,251,0,23.8,10.8,,
9/9/1925,1925,9,252,0,25.2,11.3,,
9/10/1925,1925,9,253,0,25.6,11.7,,
9/11/1925,1925,9,254,0,23.8,12.2,,
9/12/1925,1925,9,255,0,23.4,10.8,,
9/13/1925,1925,9,256,0,19.7,13.2,,
9/14/1925,1925,9,257,0,23.4,9.3,,
9/15/1925,1925,9,258,0,22.9,9.8,,
9/16/1925,1925,9,259,0,21.1,12.7,,
9/17/1925,1925,9,260,0,19.3,15.6,,
9/18/1925,1925,9,261,0,20.2,11.7,,
9/19/1925,1925,9,262,0,21.1,10.3,,
9/20/1925,1925,9,263,0,21.1,11.3,,
9/21/1925,1925,9,264,0,23.8,9.8,,
9/22/1925,1925,9,265,0,26.5,9.8,,
9/23/1925,1925,9,266,0,27.9,9.3,,
9/24/1925,1925,9,267,0,27,8.3,,
9/25/1925,1925,9,268,0,22.4,12.7,,
9/26/1925,1925,9,269,0,22.9,9.8,,
9/27/1925,1925,9,270,0,22.4,10.3,,
9/28/1925,1925,9,271,0,20.2,10.8,,
9/29/1925,1925,9,272,0,21.1,4.9,,
9/30/1925,1925,9,273,0,22.9,7.4,,
10/1/1925,1925,10,274,0,21.5,6.4,,
10/2/1925,1925,10,275,0,19.7,9.8,,
10/3/1925,1925,10,276,0,21.1,6.9,,
10/4/1925,1925,10,277,0,21.5,9.3,,
10/5/1925,1925,10,278,0,17.5,13.2,,
10/6/1925,1925,10,279,0,18.4,13.2,,
10/7/1925,1925,10,280,0,21.1,10.8,,
10/8/1925,1925,10,281,0,22,8.9,,
10/9/1925,1925,10,282,0,20.2,8.9,,
10/10/1925,1925,10,283,0,20.6,7.9,,
10/11/1925,1925,10,284,0.5,13.4,13.6,,
10/12/1925,1925,10,285,0,15.7,11.3,,
10/13/1925,1925,10,286,0,18.8,6.4,,
10/14/1925,1925,10,287,0,21.1,9.3,,
10/15/1925,1925,10,288,0,21.1,4,,
10/16/1925,1925,10,289,0,16.6,6.4,,
10/17/1925,1925,10,290,0,17.5,6,,
10/18/1925,1925,10,291,0,20.6,6.4,,
10/19/1925,1925,10,292,0,22.9,7.4,,
10/20/1925,1925,10,293,0,25.6,8.9,,
10/21/1925,1925,10,294,0,25.2,8.9,,
10/22/1925,1925,10,295,0,22.4,6.9,,
10/23/1925,1925,10,296,0,21.5,7.9,,
10/24/1925,1925,10,297,0,24.3,10.8,,
10/25/1925,1925,10,298,0,25.2,12.7,,
10/26/1925,1925,10,299,0,24.3,11.3,,
10/27/1925,1925,10,300,0,24.3,9.8,,
10/28/1925,1925,10,301,0,23.4,6.9,,
10/29/1925,1925,10,302,0,22.9,8.9,,
10/30/1925,1925,10,303,0,19.3,6.4,,
10/31/1925,1925,10,304,0,16.1,7.4,,
11/1/1925,1925,11,305,0,15.2,6.4,,
11/2/1925,1925,11,306,0,17,8.3,,
11/3/1925,1925,11,307,0,16.6,4,,
11/4/1925,1925,11,308,0,16.6,1.7,,
11/5/1925,1925,11,309,0,18.8,5.5,,
11/6/1925,1925,11,310,0,14.8,-1.7,,
11/7/1925,1925,11,311,0,17.5,-0.3,,
11/8/1925,1925,11,312,0,20.6,3,,
11/9/1925,1925,11,313,0.3,16.6,3,,
11/10/1925,1925,11,314,1.1,13.4,3,,
11/11/1925,1925,11,315,1.4,17.5,8.9,,
11/12/1925,1925,11,316,1.3,17,8.3,,
11/13/1925,1925,11,317,0,15.2,3,,
11/14/1925,1925,11,318,0,17,0.6,,
11/15/1925,1925,11,319,0,16.1,1.1,,
11/16/1925,1925,11,320,0.8,14.8,7.4,,
11/17/1925,1925,11,321,0,17,3.6,,
11/18/1925,1925,11,322,0,18.4,2.6,,
11/19/1925,1925,11,323,0,18.4,3.6,,
11/20/1925,1925,11,324,0,17.9,3,,
11/21/1925,1925,11,325,0,18.4,1.1,,
11/22/1925,1925,11,326,0,18.8,0.6,,
11/23/1925,1925,11,327,0,15.2,3.6,,
11/24/1925,1925,11,328,0,18.8,2.6,,
11/25/1925,1925,11,329,0,17,1.1,,
11/26/1925,1925,11,330,0,17,1.7,,
11/27/1925,1925,11,331,0,19.3,3,,
11/28/1925,1925,11,332,0,17.5,2.1,,
11/29/1925,1925,11,333,1.5,13.8,6.4,,
11/30/1925,1925,11,334,9.5,17.5,10.3,,
12/1/1925,1925,12,335,13.9,14.3,9.3,,
12/2/1925,1925,12,336,9.4,16.1,6.9,,
12/3/1925,1925,12,337,0,16.6,6.4,,
12/4/1925,1925,12,338,0,18.8,0.6,,
12/5/1925,1925,12,339,0,19.3,0.6,,
12/6/1925,1925,12,340,0,19.3,1.7,,
12/7/1925,1925,12,341,0,19.3,0.2,,
12/8/1925,1925,12,342,0,18.8,1.7,,
12/9/1925,1925,12,343,0,18.4,1.7,,
12/10/1925,1925,12,344,0,18.8,1.1,,
12/11/1925,1925,12,345,0,13.4,2.6,,
12/12/1925,1925,12,346,0,16.1,2.6,,
12/13/1925,1925,12,347,0,14.3,2.1,,
12/14/1925,1925,12,348,0,14.3,-1.3,,
12/15/1925,1925,12,349,0,14.3,-0.8,,
12/16/1925,1925,12,350,0,12.9,-0.3,,
12/17/1925,1925,12,351,0,9.3,1.1,,
12/18/1925,1925,12,352,13.9,13.8,6,,
12/19/1925,1925,12,353,4.5,12,6,,
12/20/1925,1925,12,354,0,12,2.1,,
12/21/1925,1925,12,355,0,12,1.7,,
12/22/1925,1925,12,356,0,13.8,0.6,,
12/23/1925,1925,12,357,0,13.8,1.7,,
12/24/1925,1925,12,358,0,9.3,4.9,,
12/25/1925,1925,12,359,0,8.4,3,,
12/26/1925,1925,12,360,0,7.1,2.6,,
12/27/1925,1925,12,361,0,7.1,2.1,,
12/28/1925,1925,12,362,0,6.6,1.1,,
12/29/1925,1925,12,363,0,7.1,2.1,,
12/30/1925,1925,12,364,0,10.2,1.7,,
12/31/1925,1925,12,365,0,5.7,1.7,,
1/1/1926,1926,1,1,0,5.7,1.7,,
1/2/1926,1926,1,2,1,6.1,1.7,,
1/3/1926,1926,1,3,0.3,11.6,2.6,,
1/4/1926,1926,1,4,0,8.9,4.9,,
1/5/1926,1926,1,5,0,8.4,4,,
1/6/1926,1926,1,6,0,12,4,,
1/7/1926,1926,1,7,0,9.8,3.6,,
1/8/1926,1926,1,8,0,7.1,2.6,,
1/9/1926,1926,1,9,0,5.7,2.1,,
1/10/1926,1926,1,10,0,5.2,1.1,,
1/11/1926,1926,1,11,0,5.2,0.6,,
1/12/1926,1926,1,12,0,4.8,0.6,,
1/13/1926,1926,1,13,0,5.2,0.6,,
1/14/1926,1926,1,14,0,4.8,0.2,,
1/15/1926,1926,1,15,1.3,14.8,-0.8,,
1/16/1926,1926,1,16,0,8,-0.3,,
1/17/1926,1926,1,17,5.3,14.8,4.5,,
1/18/1926,1926,1,18,0,12.5,0.6,,
1/19/1926,1926,1,19,0,14.3,3,,
1/20/1926,1926,1,20,0,14.3,2.6,,
1/21/1926,1926,1,21,0,14.8,-1.3,,
1/22/1926,1926,1,22,0,16.6,-0.3,,
1/23/1926,1926,1,23,0,16.1,-0.3,,
1/24/1926,1926,1,24,0,16.6,0.6,,
1/25/1926,1926,1,25,0,16.6,-0.3,,
1/26/1926,1926,1,26,0,17.9,0.2,,
1/27/1926,1926,1,27,0,14.3,0.2,,
1/28/1926,1926,1,28,6.8,12.5,4,,
1/29/1926,1926,1,29,20.3,15.2,8.3,,
1/30/1926,1926,1,30,4.9,14.3,5.5,,
1/31/1926,1926,1,31,21.1,13.4,8.3,,
2/1/1926,1926,2,32,0,14.3,6.9,,
2/2/1926,1926,2,33,8,13.8,4.5,,
2/3/1926,1926,2,34,17.1,14.3,6.9,,
2/4/1926,1926,2,35,8.8,16.6,9.8,,
2/5/1926,1926,2,36,1.2,16.1,8.3,,
2/6/1926,1926,2,37,0,17,6.9,,
2/7/1926,1926,2,38,0,18.8,6.4,,
2/8/1926,1926,2,39,0,16.6,4.9,,
2/9/1926,1926,2,40,0,12.5,6.4,,
2/10/1926,1926,2,41,0,17.9,8.9,,
2/11/1926,1926,2,42,5.1,11.6,4,,
2/12/1926,1926,2,43,17.7,14.3,6.4,,
2/13/1926,1926,2,44,39.8,11.1,6.4,,
2/14/1926,1926,2,45,0,17,5.5,,
2/15/1926,1926,2,46,1.8,15.2,5.5,,
2/16/1926,1926,2,47,0,16.6,2.1,,
2/17/1926,1926,2,48,0,16.1,3,,
2/18/1926,1926,2,49,0,16.1,3,,
2/19/1926,1926,2,50,7.5,16.6,6.4,,
2/20/1926,1926,2,51,1,17.5,3,,
2/21/1926,1926,2,52,0,17.9,3.6,,
2/22/1926,1926,2,53,0,17.5,4.5,,
2/23/1926,1926,2,54,0,16.6,4,,
2/24/1926,1926,2,55,0,18.4,4,,
2/25/1926,1926,2,56,0,22.4,8.9,,
2/26/1926,1926,2,57,0,22.4,4.9,,
2/27/1926,1926,2,58,0,22.9,4.5,,
2/28/1926,1926,2,59,0,22.9,4,,
3/1/1926,1926,3,60,0,22,6,,
3/2/1926,1926,3,61,0,22,7.9,,
3/3/1926,1926,3,62,0,20.6,6.4,,
3/4/1926,1926,3,63,0,19.3,6.4,,
3/5/1926,1926,3,64,0,17.9,5.5,,
3/6/1926,1926,3,65,0,18.4,6,,
3/7/1926,1926,3,66,0,18.4,4,,
3/8/1926,1926,3,67,0,18.4,9.3,,
3/9/1926,1926,3,68,0,17.9,6,,
3/10/1926,1926,3,69,0,21.1,4,,
3/11/1926,1926,3,70,0,20.6,4,,
3/12/1926,1926,3,71,0,23.4,4.9,,
3/13/1926,1926,3,72,0,25.6,6,,
3/14/1926,1926,3,73,0,26.1,6.4,,
3/15/1926,1926,3,74,0,22.4,6.4,,
3/16/1926,1926,3,75,0,18.4,4.9,,
3/17/1926,1926,3,76,0,18.8,6.4,,
3/18/1926,1926,3,77,0,16.1,3.6,,
3/19/1926,1926,3,78,1.3,22,6.4,,
3/20/1926,1926,3,79,0,22,6.4,,
3/21/1926,1926,3,80,0,24.3,10.3,,
3/22/1926,1926,3,81,0,27,9.8,,
3/23/1926,1926,3,82,0,26.1,4.9,,
3/24/1926,1926,3,83,0,26.1,11.3,,
3/25/1926,1926,3,84,0,24.7,13.6,,
3/26/1926,1926,3,85,0,25.6,11.3,,
3/27/1926,1926,3,86,0,24.3,4.9,,
3/28/1926,1926,3,87,0,24.3,6.4,,
3/29/1926,1926,3,88,0,24.7,10.3,,
3/30/1926,1926,3,89,0,25.2,6.4,,
3/31/1926,1926,3,90,0,19.7,10.3,,
4/1/1926,1926,4,91,0,21.1,6,,
4/2/1926,1926,4,92,0,18.8,6,,
4/3/1926,1926,4,93,0,18.4,9.8,,
4/4/1926,1926,4,94,65.1,16.6,10.8,,
4/5/1926,1926,4,95,13.8,18.4,8.9,,
4/6/1926,1926,4,96,1,19.3,12.2,,
4/7/1926,1926,4,97,8.3,19.3,12.2,,
4/8/1926,1926,4,98,16.1,17.5,12.2,,
4/9/1926,1926,4,99,4.9,18.4,10.3,,
4/10/1926,1926,4,100,0,18.8,8.9,,
4/11/1926,1926,4,101,0,20.2,8.3,,
4/12/1926,1926,4,102,0,22,8.3,,
4/13/1926,1926,4,103,0,25.2,11.7,,
4/14/1926,1926,4,104,0,27.5,11.3,,
4/15/1926,1926,4,105,0,27,10.3,,
4/16/1926,1926,4,106,0,25.6,6.4,,
4/17/1926,1926,4,107,0,26.5,12.7,,
4/18/1926,1926,4,108,7.5,18.4,10.8,,
4/19/1926,1926,4,109,0,21.1,7.9,,
4/20/1926,1926,4,110,0,22.9,10.3,,
4/21/1926,1926,4,111,0,24.3,8.9,,
4/22/1926,1926,4,112,0,25.2,10.8,,
4/23/1926,1926,4,113,0,25.6,9.8,,
4/24/1926,1926,4,114,0,28.4,11.3,,
4/25/1926,1926,4,115,0,30.2,13.6,,
4/26/1926,1926,4,116,0,32.5,14.7,,
4/27/1926,1926,4,117,0,31.6,13.6,,
4/28/1926,1926,4,118,0,28.4,13.6,,
4/29/1926,1926,4,119,0,25.2,12.7,,
4/30/1926,1926,4,120,0,24.7,12.2,,
5/1/1926,1926,5,121,0,22.4,10.8,,
5/2/1926,1926,5,122,0,23.8,9.8,,
5/3/1926,1926,5,123,0,22.9,10.3,,
5/4/1926,1926,5,124,0,24.7,14.1,,
5/5/1926,1926,5,125,2.4,18.4,8.9,,
5/6/1926,1926,5,126,4.8,20.6,10.8,,
5/7/1926,1926,5,127,1.7,17,6,,
5/8/1926,1926,5,128,0,17.9,4,,
5/9/1926,1926,5,129,0,20.6,6.4,,
5/10/1926,1926,5,130,0,23.4,6.4,,
5/11/1926,1926,5,131,0,26.1,9.8,,
5/12/1926,1926,5,132,0,28.4,10.8,,
5/13/1926,1926,5,133,0,26.5,10.3,,
5/14/1926,1926,5,134,0,25.2,8.9,,
5/15/1926,1926,5,135,0,24.7,8.9,,
5/16/1926,1926,5,136,0,27.9,11.3,,
5/17/1926,1926,5,137,0,29.3,14.1,,
5/18/1926,1926,5,138,0,29.7,20,,
5/19/1926,1926,5,139,0,31.6,15.1,,
5/20/1926,1926,5,140,0,29.3,13.2,,
5/21/1926,1926,5,141,0,28.4,12.2,,
5/22/1926,1926,5,142,0,28.8,13.2,,
5/23/1926,1926,5,143,0,22.9,12.2,,
5/24/1926,1926,5,144,0,21.5,6.9,,
5/25/1926,1926,5,145,0,22,6.4,,
5/26/1926,1926,5,146,0,24.3,8.3,,
5/27/1926,1926,5,147,0,26.5,12.2,,
5/28/1926,1926,5,148,0,29.7,11.7,,
5/29/1926,1926,5,149,0,31.1,15.6,,
5/30/1926,1926,5,150,0,31.6,13.2,,
5/31/1926,1926,5,151,0,31.6,12.7,,
6/1/1926,1926,6,152,0,33.8,12.7,,
6/2/1926,1926,6,153,0,33.8,12.2,,
6/3/1926,1926,6,154,0,33.8,12.2,,
6/4/1926,1926,6,155,0,32,12.2,,
6/5/1926,1926,6,156,0,36.1,21.3,,
6/6/1926,1926,6,157,0,37.9,17,,
6/7/1926,1926,6,158,0,32.9,16,,
6/8/1926,1926,6,159,0,25.2,15.1,,
6/9/1926,1926,6,160,0,25.6,12.7,,
6/10/1926,1926,6,161,0,28.4,12.7,,
6/11/1926,1926,6,162,0,28.4,10.8,,
6/12/1926,1926,6,163,0,29.3,12.7,,
6/13/1926,1926,6,164,0,27,9.8,,
6/14/1926,1926,6,165,0,25.6,9.3,,
6/15/1926,1926,6,166,0,26.5,8.9,,
6/16/1926,1926,6,167,0,26.5,11.3,,
6/17/1926,1926,6,168,0,27.9,10.8,,
6/18/1926,1926,6,169,0,29.7,12.7,,
6/19/1926,1926,6,170,0,28.8,12.2,,
6/20/1926,1926,6,171,0,27.9,11.3,,
6/21/1926,1926,6,172,0,30.2,11.3,,
6/22/1926,1926,6,173,0,32,12.2,,
6/23/1926,1926,6,174,0,32,12.2,,
6/24/1926,1926,6,175,0,32.5,12.2,,
6/25/1926,1926,6,176,0,30.2,12.7,,
6/26/1926,1926,6,177,0,33.8,14.1,,
6/27/1926,1926,6,178,0,33.4,15.1,,
6/28/1926,1926,6,179,0,34.3,16.6,,
6/29/1926,1926,6,180,0,35.7,13.2,,
6/30/1926,1926,6,181,0,31.6,11.3,,
7/1/1926,1926,7,182,0,26.5,11.7,,
7/2/1926,1926,7,183,0,30.2,13.2,,
7/3/1926,1926,7,184,0,32,14.1,,
7/4/1926,1926,7,185,0,34.7,16,,
7/5/1926,1926,7,186,0,35.2,17,,
7/6/1926,1926,7,187,0,32.5,15.6,,
7/7/1926,1926,7,188,0,28.4,14.7,,
7/8/1926,1926,7,189,0,28.8,13.2,,
7/9/1926,1926,7,190,0,29.3,15.1,,
7/10/1926,1926,7,191,0,29.3,16,,
7/11/1926,1926,7,192,0,30.6,15.6,,
7/12/1926,1926,7,193,0,32.9,16,,
7/13/1926,1926,7,194,0,32.9,13.6,,
7/14/1926,1926,7,195,0,33.8,13.2,,
7/15/1926,1926,7,196,0,36.1,15.1,,
7/16/1926,1926,7,197,0,37.9,17,,
7/17/1926,1926,7,198,0,37.9,16,,
7/18/1926,1926,7,199,0,36.6,15.6,,
7/19/1926,1926,7,200,0,35.7,12.7,,
7/20/1926,1926,7,201,0,32.5,11.7,,
7/21/1926,1926,7,202,0,33.4,11.7,,
7/22/1926,1926,7,203,0,27.9,10.8,,
7/23/1926,1926,7,204,0,30.6,13.2,,
7/24/1926,1926,7,205,0,33.4,14.7,,
7/25/1926,1926,7,206,0,32.9,13.2,,
7/26/1926,1926,7,207,0,32,13.6,,
7/27/1926,1926,7,208,0,28.4,12.7,,
7/28/1926,1926,7,209,0,26.5,11.7,,
7/29/1926,1926,7,210,0,30.6,11.7,,
7/30/1926,1926,7,211,0,32.9,14.1,,
7/31/1926,1926,7,212,0,35.2,13.6,,
8/1/1926,1926,8,213,0,34.3,12.7,,
8/2/1926,1926,8,214,0,33.8,14.7,,
8/3/1926,1926,8,215,0,28.4,12.7,,
8/4/1926,1926,8,216,0,30.2,11.7,,
8/5/1926,1926,8,217,0,32,20,,
8/6/1926,1926,8,218,0,30.6,13.6,,
8/7/1926,1926,8,219,0,29.3,12.7,,
8/8/1926,1926,8,220,0,30.6,12.2,,
8/9/1926,1926,8,221,0,30.2,12.2,,
8/10/1926,1926,8,222,0,25.2,12.2,,
8/11/1926,1926,8,223,0,28.8,12.2,,
8/12/1926,1926,8,224,0,25.6,11.3,,
8/13/1926,1926,8,225,0,27,8.3,,
8/14/1926,1926,8,226,0,32,10.3,,
8/15/1926,1926,8,227,0,32.9,10.3,,
8/16/1926,1926,8,228,0,32,12.2,,
8/17/1926,1926,8,229,0,28.8,11.7,,
8/18/1926,1926,8,230,0,29.3,16.6,,
8/19/1926,1926,8,231,0,28.8,16,,
8/20/1926,1926,8,232,0,30.6,16,,
8/21/1926,1926,8,233,0,31.6,14.7,,
8/22/1926,1926,8,234,0,24.3,9.3,,
8/23/1926,1926,8,235,0,29.7,9.8,,
8/24/1926,1926,8,236,0,34.3,16,,
8/25/1926,1926,8,237,0,34.7,16.6,,
8/26/1926,1926,8,238,0,24.3,11.7,,
8/27/1926,1926,8,239,0,26.1,14.1,,
8/28/1926,1926,8,240,0,30.2,14.7,,
8/29/1926,1926,8,241,0,27.5,14.7,,
8/30/1926,1926,8,242,0,22.4,9.8,,
8/31/1926,1926,8,243,0,22.4,20,,
9/1/1926,1926,9,244,0,28.4,17,,
9/2/1926,1926,9,245,0,31.1,13.6,,
9/3/1926,1926,9,246,0,32,12.7,,
9/4/1926,1926,9,247,0,29.7,13.6,,
9/5/1926,1926,9,248,0,28.4,13.6,,
9/6/1926,1926,9,249,0,27.9,14.1,,
9/7/1926,1926,9,250,0,25.6,11.7,,
9/8/1926,1926,9,251,0,25.6,9.8,,
9/9/1926,1926,9,252,0,27.9,11.7,,
9/10/1926,1926,9,253,0,29.7,12.7,,
9/11/1926,1926,9,254,0,26.1,10.8,,
9/12/1926,1926,9,255,0,24.3,10.3,,
9/13/1926,1926,9,256,0,24.7,8.3,,
9/14/1926,1926,9,257,0,25.6,7.4,,
9/15/1926,1926,9,258,0,26.1,14.1,,
9/16/1926,1926,9,259,0,22,9.3,,
9/17/1926,1926,9,260,0,23.4,8.9,,
9/18/1926,1926,9,261,0,23.8,7.4,,
9/19/1926,1926,9,262,0,22.4,4.9,,
9/20/1926,1926,9,263,0,22.9,10.8,,
9/21/1926,1926,9,264,0,22.4,8.9,,
9/22/1926,1926,9,265,0,24.3,5.5,,
9/23/1926,1926,9,266,0,26.1,9.8,,
9/24/1926,1926,9,267,0,27.5,10.8,,
9/25/1926,1926,9,268,0,27,16,,
9/26/1926,1926,9,269,0,27.5,8.9,,
9/27/1926,1926,9,270,0,28.8,7.4,,
9/28/1926,1926,9,271,0,27.9,7.9,,
9/29/1926,1926,9,272,0,25.2,10.8,,
9/30/1926,1926,9,273,0,21.5,7.4,,
10/1/1926,1926,10,274,6.2,22,12.2,,
10/2/1926,1926,10,275,8.9,17.9,11.3,,
10/3/1926,1926,10,276,0,21.1,13.2,,
10/4/1926,1926,10,277,0,23.8,8.9,,
10/5/1926,1926,10,278,0,26.5,9.8,,
10/6/1926,1926,10,279,0,28.4,9.3,,
10/7/1926,1926,10,280,0,27.5,12.7,,
10/8/1926,1926,10,281,0,22,4.5,,
10/9/1926,1926,10,282,0,20.2,6,,
10/10/1926,1926,10,283,8.8,19.3,11.7,,
10/11/1926,1926,10,284,0,18.8,6.9,,
10/12/1926,1926,10,285,0,20.2,7.9,,
10/13/1926,1926,10,286,0,23.4,8.3,,
10/14/1926,1926,10,287,0,24.3,8.9,,
10/15/1926,1926,10,288,0,22.9,8.3,,
10/16/1926,1926,10,289,0,25.6,9.3,,
10/17/1926,1926,10,290,0,25.2,10.3,,
10/18/1926,1926,10,291,0,26.1,12.2,,
10/19/1926,1926,10,292,0,25.2,13.6,,
10/20/1926,1926,10,293,0,26.1,7.9,,
10/21/1926,1926,10,294,0,21.5,7.4,,
10/22/1926,1926,10,295,0,18.8,6.9,,
10/23/1926,1926,10,296,0,22.9,6.4,,
10/24/1926,1926,10,297,0,22,7.4,,
10/25/1926,1926,10,298,0,24.3,10.3,,
10/26/1926,1926,10,299,0,25.2,11.3,,
10/27/1926,1926,10,300,0,26.1,11.3,,
10/28/1926,1926,10,301,0,26.5,12.7,,
10/29/1926,1926,10,302,0,25.2,10.8,,
10/30/1926,1926,10,303,0,22.9,8.9,,
10/31/1926,1926,10,304,0,23.8,1.7,,
11/1/1926,1926,11,305,0,23.4,2.1,,
11/2/1926,1926,11,306,0,23.8,2.1,,
11/3/1926,1926,11,307,0,23.4,3,,
11/4/1926,1926,11,308,0,23.8,2.6,,
11/5/1926,1926,11,309,0,22.9,3,,
11/6/1926,1926,11,310,0,24.3,2.1,,
11/7/1926,1926,11,311,0,23.4,4.9,,
11/8/1926,1926,11,312,0,26.1,6.9,,
11/9/1926,1926,11,313,0,24.3,4.9,,
11/10/1926,1926,11,314,0,22.4,7.4,,
11/11/1926,1926,11,315,7,22,10.3,,
11/12/1926,1926,11,316,1.5,17,9.3,,
11/13/1926,1926,11,317,1.1,17.9,6.4,,
11/14/1926,1926,11,318,0,18.4,3.6,,
11/15/1926,1926,11,319,0,17,3,,
11/16/1926,1926,11,320,0,18.4,4.9,,
11/17/1926,1926,11,321,0,20.2,6.4,,
11/18/1926,1926,11,322,8.5,20.6,6.4,,
11/19/1926,1926,11,323,9.5,13.8,9.8,,
11/20/1926,1926,11,324,1.1,17,8.3,,
11/21/1926,1926,11,325,0,19.3,8.9,,
11/22/1926,1926,11,326,4,17,13.2,,
11/23/1926,1926,11,327,0.9,18.8,11.7,,
11/24/1926,1926,11,328,29.1,17.9,11.7,,
11/25/1926,1926,11,329,0,16.6,8.9,,
11/26/1926,1926,11,330,24,14.3,7.9,,
11/27/1926,1926,11,331,10.2,16.1,7.9,,
11/28/1926,1926,11,332,0.6,17,8.9,,
11/29/1926,1926,11,333,0.4,16.6,10.3,,
11/30/1926,1926,11,334,0,17.9,10.3,,
12/1/1926,1926,12,335,0,16.6,8.9,,
12/2/1926,1926,12,336,3.1,14.8,10.8,,
12/3/1926,1926,12,337,3.1,14.3,11.3,,
12/4/1926,1926,12,338,0,15.7,4,,
12/5/1926,1926,12,339,0,16.1,4.5,,
12/6/1926,1926,12,340,0,15.7,4.9,,
12/7/1926,1926,12,341,0,14.3,9.3,,
12/8/1926,1926,12,342,0,15.7,14.1,,
12/9/1926,1926,12,343,0,14.8,6.9,,
12/10/1926,1926,12,344,0,15.7,3,,
12/11/1926,1926,12,345,0,18.8,0.6,,
12/12/1926,1926,12,346,0,13.4,3,,
12/13/1926,1926,12,347,0,12.9,-0.3,,
12/14/1926,1926,12,348,0,12,0.2,,
12/15/1926,1926,12,349,0,10.7,-2.2,,
12/16/1926,1926,12,350,0,12,-0.8,,
12/17/1926,1926,12,351,2.3,13.8,2.1,,
12/18/1926,1926,12,352,9.7,10.7,1.1,,
12/19/1926,1926,12,353,0,13.8,-0.3,,
12/20/1926,1926,12,354,0,11.1,-0.8,,
12/21/1926,1926,12,355,1.9,9.3,3,,
12/22/1926,1926,12,356,0,10.7,-0.8,,
12/23/1926,1926,12,357,0,10.2,2.6,,
12/24/1926,1926,12,358,0,9.3,-1.3,,
12/25/1926,1926,12,359,2.3,9.3,4,,
12/26/1926,1926,12,360,0,5.7,-0.8,,
12/27/1926,1926,12,361,0,11.1,-2.2,,
12/28/1926,1926,12,362,0,10.7,-1.3,,
12/29/1926,1926,12,363,0,11.1,-1.3,,
12/30/1926,1926,12,364,0,11.6,-0.8,,
12/31/1926,1926,12,365,0,12.5,-2.2,,
1/1/1927,1927,1,1,0,12,3,,
1/2/1927,1927,1,2,1,12,6.4,,
1/3/1927,1927,1,3,1.3,12.5,11.7,,
1/4/1927,1927,1,4,0.3,13.4,11.7,,
1/5/1927,1927,1,5,0,14.3,11.7,,
1/6/1927,1927,1,6,7,14.8,11.3,,
1/7/1927,1927,1,7,0,15.2,2.6,,
1/8/1927,1927,1,8,0,13.4,3.6,,
1/9/1927,1927,1,9,0,14.3,4,,
1/10/1927,1927,1,10,13.4,14.8,6.9,,
1/11/1927,1927,1,11,7.6,14.8,11.3,,
1/12/1927,1927,1,12,0,16.1,4,,
1/13/1927,1927,1,13,0,14.8,6.4,,
1/14/1927,1927,1,14,0,14.3,6.9,,
1/15/1927,1927,1,15,5.4,12.9,9.8,,
1/16/1927,1927,1,16,9.9,13.8,6,,
1/17/1927,1927,1,17,0,12.9,2.6,,
1/18/1927,1927,1,18,0,12.9,3.6,,
1/19/1927,1927,1,19,1,13.8,3,,
1/20/1927,1927,1,20,8.3,12.9,6.9,,
1/21/1927,1927,1,21,0,13.8,6,,
1/22/1927,1927,1,22,0,9.8,1.7,,
1/23/1927,1927,1,23,0,12,-0.8,,
1/24/1927,1927,1,24,0,12,0.6,,
1/25/1927,1927,1,25,0.3,12.9,5.5,,
1/26/1927,1927,1,26,8.3,12.9,7.4,,
1/27/1927,1927,1,27,3.5,12.9,4.5,,
1/28/1927,1927,1,28,2.2,14.3,10.3,,
1/29/1927,1927,1,29,0,16.1,6.4,,
1/30/1927,1927,1,30,0,14.3,4.5,,
1/31/1927,1927,1,31,0,14.3,4.5,,
2/1/1927,1927,2,32,0,15.2,7.4,,
2/2/1927,1927,2,33,10.2,13.8,9.3,,
2/3/1927,1927,2,34,21.4,14.3,10.8,,
2/4/1927,1927,2,35,0.5,14.3,3.6,,
2/5/1927,1927,2,36,0.2,14.8,6,,
2/6/1927,1927,2,37,2.9,12.5,6.9,,
2/7/1927,1927,2,38,0.2,12,3,,
2/8/1927,1927,2,39,0,13.8,2.6,,
2/9/1927,1927,2,40,0,14.8,2.6,,
2/10/1927,1927,2,41,0,15.7,2.1,,
2/11/1927,1927,2,42,0,14.8,3,,
2/12/1927,1927,2,43,0,17.5,-0.8,,
2/13/1927,1927,2,44,0.2,14.3,4.9,,
2/14/1927,1927,2,45,16.8,12,6,,
2/15/1927,1927,2,46,13.4,12,8.3,,
2/16/1927,1927,2,47,19.5,15.7,10.8,,
2/17/1927,1927,2,48,0.7,15.7,8.3,,
2/18/1927,1927,2,49,18.8,15.2,11.7,,
2/19/1927,1927,2,50,0,17.5,7.9,,
2/20/1927,1927,2,51,1.2,13.4,10.3,,
2/21/1927,1927,2,52,3.7,15.2,12.2,,
2/22/1927,1927,2,53,1,16.1,6,,
2/23/1927,1927,2,54,0.2,17.5,6,,
2/24/1927,1927,2,55,1.9,15.7,10.8,,
2/25/1927,1927,2,56,0.5,13.8,12.2,,
2/26/1927,1927,2,57,0,19.3,6.4,,
2/27/1927,1927,2,58,0,17,6.4,,
2/28/1927,1927,2,59,0,15.7,2.1,,
3/1/1927,1927,3,60,0,17.5,5.5,,
3/2/1927,1927,3,61,0,17,7.9,,
3/3/1927,1927,3,62,5.8,13.8,6.4,,
3/4/1927,1927,3,63,1.8,14.3,6.4,,
3/5/1927,1927,3,64,0,11.6,2.1,,
3/6/1927,1927,3,65,0,19.3,3.6,,
3/7/1927,1927,3,66,0,18.8,4,,
3/8/1927,1927,3,67,0.4,19.3,8.3,,
3/9/1927,1927,3,68,6.2,15.2,6,,
3/10/1927,1927,3,69,4.4,11.1,3,,
3/11/1927,1927,3,70,0,16.6,4,,
3/12/1927,1927,3,71,0,21.5,6.4,,
3/13/1927,1927,3,72,17.8,19.3,10.8,,
3/14/1927,1927,3,73,4.9,16.1,2.1,,
3/15/1927,1927,3,74,0,12.5,1.7,,
3/16/1927,1927,3,75,0,13.4,0.6,,
3/17/1927,1927,3,76,0.9,12.9,7.9,,
3/18/1927,1927,3,77,0,15.7,1.1,,
3/19/1927,1927,3,78,0,14.8,3.6,,
3/20/1927,1927,3,79,0,17,4.5,,
3/21/1927,1927,3,80,0,19.3,3.6,,
3/22/1927,1927,3,81,0,20.2,6.4,,
3/23/1927,1927,3,82,0,24.7,6,,
3/24/1927,1927,3,83,0,25.6,7.9,,
3/25/1927,1927,3,84,0,23.8,4,,
3/26/1927,1927,3,85,0,24.3,4.9,,
3/27/1927,1927,3,86,0,16.1,7.9,,
3/28/1927,1927,3,87,0,14.8,4.5,,
3/29/1927,1927,3,88,2.2,17.5,9.3,,
3/30/1927,1927,3,89,0,15.7,4,,
3/31/1927,1927,3,90,3.1,12.9,8.3,,
4/1/1927,1927,4,91,13,12.5,10.3,,
4/2/1927,1927,4,92,17.1,12.5,10.3,,
4/3/1927,1927,4,93,3,17,11.3,,
4/4/1927,1927,4,94,0,17.9,4.9,,
4/5/1927,1927,4,95,0,17.9,4.9,,
4/6/1927,1927,4,96,0,18.4,6.9,,
4/7/1927,1927,4,97,0,17.9,4.5,,
4/8/1927,1927,4,98,0,16.1,6.4,,
4/9/1927,1927,4,99,10.9,13.8,1.7,,
4/10/1927,1927,4,100,0,12.5,1.1,,
4/11/1927,1927,4,101,0,15.7,2.1,,
4/12/1927,1927,4,102,0,15.2,1.7,,
4/13/1927,1927,4,103,0,19.3,3.6,,
4/14/1927,1927,4,104,0,21.5,4.9,,
4/15/1927,1927,4,105,0.2,19.3,8.3,,
4/16/1927,1927,4,106,0,19.3,3,,
4/17/1927,1927,4,107,0,16.6,5.5,,
4/18/1927,1927,4,108,0,21.5,4.5,,
4/19/1927,1927,4,109,0,21.1,6.4,,
4/20/1927,1927,4,110,0,21.1,4.5,,
4/21/1927,1927,4,111,0,23.8,7.4,,
4/22/1927,1927,4,112,0,25.6,6.4,,
4/23/1927,1927,4,113,0,27.9,6.9,,
4/24/1927,1927,4,114,0,29.3,9.3,,
4/25/1927,1927,4,115,0,29.7,10.3,,
4/26/1927,1927,4,116,0,27.5,10.3,,
4/27/1927,1927,4,117,0,23.8,10.8,,
4/28/1927,1927,4,118,0,21.5,8.3,,
4/29/1927,1927,4,119,0,25.2,6.9,,
4/30/1927,1927,4,120,0,23.4,6.4,,
5/1/1927,1927,5,121,0,19.3,7.4,,
5/2/1927,1927,5,122,0,20.6,6.4,,
5/3/1927,1927,5,123,0,23.8,8.3,,
5/4/1927,1927,5,124,0,24.7,9.3,,
5/5/1927,1927,5,125,0,25.6,9.3,,
5/6/1927,1927,5,126,0,21.1,7.4,,
5/7/1927,1927,5,127,0,18.8,7.4,,
5/8/1927,1927,5,128,0,20.6,6,,
5/9/1927,1927,5,129,0,21.5,6,,
5/10/1927,1927,5,130,0,22.4,8.9,,
5/11/1927,1927,5,131,0,21.5,8.3,,
5/12/1927,1927,5,132,0,23.8,7.9,,
5/13/1927,1927,5,133,0,27.9,12.7,,
5/14/1927,1927,5,134,0,29.3,14.7,,
5/15/1927,1927,5,135,0,30.6,12.7,,
5/16/1927,1927,5,136,0,32,13.6,,
5/17/1927,1927,5,137,0,27.5,6.9,,
5/18/1927,1927,5,138,0,22.9,7.9,,
5/19/1927,1927,5,139,0,22.9,13.2,,
5/20/1927,1927,5,140,1.8,18.8,7.4,,
5/21/1927,1927,5,141,0,18.4,3.6,,
5/22/1927,1927,5,142,0,20.6,9.3,,
5/23/1927,1927,5,143,0,23.8,11.7,,
5/24/1927,1927,5,144,0,26.5,12.2,,
5/25/1927,1927,5,145,0,28.8,12.2,,
5/26/1927,1927,5,146,0,27.5,9.3,,
5/27/1927,1927,5,147,3.3,17.9,6.9,,
5/28/1927,1927,5,148,0,15.2,5.5,,
5/29/1927,1927,5,149,0,18.8,8.9,,
5/30/1927,1927,5,150,0,22.4,8.9,,
5/31/1927,1927,5,151,0,23.8,7.9,,
6/1/1927,1927,6,152,0,23.8,8.9,,
6/2/1927,1927,6,153,0,24.7,9.8,,
6/3/1927,1927,6,154,0,27.5,10.3,,
6/4/1927,1927,6,155,0,26.1,10.3,,
6/5/1927,1927,6,156,0,9.8,6,,
6/6/1927,1927,6,157,0,28.8,9.8,,
6/7/1927,1927,6,158,8.6,28.4,12.7,,
6/8/1927,1927,6,159,0,16.6,11.3,,
6/9/1927,1927,6,160,0,21.5,14.1,,
6/10/1927,1927,6,161,0,24.7,12.2,,
6/11/1927,1927,6,162,0,23.8,11.7,,
6/12/1927,1927,6,163,0,24.7,12.2,,
6/13/1927,1927,6,164,0,30.2,12.7,,
6/14/1927,1927,6,165,0,31.6,14.1,,
6/15/1927,1927,6,166,0,33.4,14.1,,
6/16/1927,1927,6,167,0,34.3,12.2,,
6/17/1927,1927,6,168,0,31.6,11.7,,
6/18/1927,1927,6,169,0,27,7.9,,
6/19/1927,1927,6,170,0,29.7,11.7,,
6/20/1927,1927,6,171,0,27,8.9,,
6/21/1927,1927,6,172,0,27.5,11.3,,
6/22/1927,1927,6,173,0,27.5,10.3,,
6/23/1927,1927,6,174,0,28.8,11.7,,
6/24/1927,1927,6,175,0,25.6,10.8,,
6/25/1927,1927,6,176,0,27.5,13.6,,
6/26/1927,1927,6,177,0,26.1,10.8,,
6/27/1927,1927,6,178,0,20.6,10.8,,
6/28/1927,1927,6,179,0,23.4,18,,
6/29/1927,1927,6,180,0,27,14.1,,
6/30/1927,1927,6,181,0,31.6,22.8,,
7/1/1927,1927,7,182,0,32.9,17.5,,
7/2/1927,1927,7,183,0,32,13.6,,
7/3/1927,1927,7,184,0,22,11.3,,
7/4/1927,1927,7,185,0,24.7,9.3,,
7/5/1927,1927,7,186,0,26.1,11.3,,
7/6/1927,1927,7,187,0,29.7,13.6,,
7/7/1927,1927,7,188,0,28.8,11.7,,
7/8/1927,1927,7,189,0,27.9,11.7,,
7/9/1927,1927,7,190,0,29.7,11.3,,
7/10/1927,1927,7,191,0,31.6,13.2,,
7/11/1927,1927,7,192,0,32,12.7,,
7/12/1927,1927,7,193,0,33.4,17,,
7/13/1927,1927,7,194,0,34.7,18,,
7/14/1927,1927,7,195,0,33.4,12.7,,
7/15/1927,1927,7,196,0,31.1,13.6,,
7/16/1927,1927,7,197,0,26.1,13.2,,
7/17/1927,1927,7,198,0,26.1,9.3,,
7/18/1927,1927,7,199,0,30.2,11.3,,
7/19/1927,1927,7,200,0,31.6,11.3,,
7/20/1927,1927,7,201,0,28.8,12.2,,
7/21/1927,1927,7,202,0,28.8,10.3,,
7/22/1927,1927,7,203,0,33.8,15.6,,
7/23/1927,1927,7,204,0,35.2,17.5,,
7/24/1927,1927,7,205,0,31.6,14.1,,
7/25/1927,1927,7,206,0,28.8,13.2,,
7/26/1927,1927,7,207,0,29.7,15.1,,
7/27/1927,1927,7,208,0,27.9,13.2,,
7/28/1927,1927,7,209,0,30.2,13.6,,
7/29/1927,1927,7,210,0,32.5,15.1,,
7/30/1927,1927,7,211,0,27.5,12.2,,
7/31/1927,1927,7,212,0,27.9,13.2,,
8/1/1927,1927,8,213,0,26.1,12.7,,
8/2/1927,1927,8,214,0,26.1,11.3,,
8/3/1927,1927,8,215,0,27,12.2,,
8/4/1927,1927,8,216,0,29.3,12.7,,
8/5/1927,1927,8,217,0,29.7,11.3,,
8/6/1927,1927,8,218,0,32,13.6,,
8/7/1927,1927,8,219,0,30.6,12.7,,
8/8/1927,1927,8,220,0,29.7,12.7,,
8/9/1927,1927,8,221,0,31.1,10.3,,
8/10/1927,1927,8,222,0,31.6,11.7,,
8/11/1927,1927,8,223,0,30.6,11.7,,
8/12/1927,1927,8,224,0,26.5,15.1,,
8/13/1927,1927,8,225,0,24.3,12.2,,
8/14/1927,1927,8,226,0,25.2,12.2,,
8/15/1927,1927,8,227,0,28.4,13.2,,
8/16/1927,1927,8,228,0,30.2,12.7,,
8/17/1927,1927,8,229,0,30.6,12.7,,
8/18/1927,1927,8,230,0,29.3,12.7,,
8/19/1927,1927,8,231,0,27,11.7,,
8/20/1927,1927,8,232,0,29.3,10.3,,
8/21/1927,1927,8,233,0,32.9,14.7,,
8/22/1927,1927,8,234,0,30.6,12.2,,
8/23/1927,1927,8,235,0,25.2,9.3,,
8/24/1927,1927,8,236,0,24.7,11.3,,
8/25/1927,1927,8,237,0,27,11.7,,
8/26/1927,1927,8,238,0,28.8,11.7,,
8/27/1927,1927,8,239,0,30.2,14.7,,
8/28/1927,1927,8,240,0,22.9,15.1,,
8/29/1927,1927,8,241,0,22.4,12.2,,
8/30/1927,1927,8,242,0,23.8,8.3,,
8/31/1927,1927,8,243,0,25.2,8.9,,
9/1/1927,1927,9,244,1,28.4,7.9,,
9/2/1927,1927,9,245,0,28.8,11.7,,
9/3/1927,1927,9,246,0,26.5,17,,
9/4/1927,1927,9,247,0,19.7,8.9,,
9/5/1927,1927,9,248,0,26.1,9.8,,
9/6/1927,1927,9,249,0,27,12.2,,
9/7/1927,1927,9,250,0,23.4,13.2,,
9/8/1927,1927,9,251,0,22.4,10.3,,
9/9/1927,1927,9,252,0,22.4,8.9,,
9/10/1927,1927,9,253,0,23.4,8.3,,
9/11/1927,1927,9,254,0,26.1,9.8,,
9/12/1927,1927,9,255,0,26.5,12.2,,
9/13/1927,1927,9,256,0,22.4,14.7,,
9/14/1927,1927,9,257,0,22,7.9,,
9/15/1927,1927,9,258,0,22.4,6.4,,
9/16/1927,1927,9,259,0,25.6,12.7,,
9/17/1927,1927,9,260,0,24.7,10.3,,
9/18/1927,1927,9,261,0,24.7,10.8,,
9/19/1927,1927,9,262,0,27,9.8,,
9/20/1927,1927,9,263,0,27,9.3,,
9/21/1927,1927,9,264,0,27,7.4,,
9/22/1927,1927,9,265,0,25.6,8.3,,
9/23/1927,1927,9,266,0,26.1,10.8,,
9/24/1927,1927,9,267,0,25.6,8.9,,
9/25/1927,1927,9,268,0,24.7,12.7,,
9/26/1927,1927,9,269,0,27,9.3,,
9/27/1927,1927,9,270,0,27.9,12.7,,
9/28/1927,1927,9,271,0,25.6,14.7,,
9/29/1927,1927,9,272,0,24.3,8.9,,
9/30/1927,1927,9,273,0,22.4,14.1,,
10/1/1927,1927,10,274,0,22,14.1,,
10/2/1927,1927,10,275,0,25.6,9.3,,
10/3/1927,1927,10,276,0,27.5,10.8,,
10/4/1927,1927,10,277,0,27.5,8.3,,
10/5/1927,1927,10,278,0,21.5,9.3,,
10/6/1927,1927,10,279,0,20.2,7.4,,
10/7/1927,1927,10,280,0,22.4,9.3,,
10/8/1927,1927,10,281,0,24.3,6,,
10/9/1927,1927,10,282,0,27,3.6,,
10/10/1927,1927,10,283,0,27.5,5.5,,
10/11/1927,1927,10,284,0,26.5,11.3,,
10/12/1927,1927,10,285,0,27.9,6.9,,
10/13/1927,1927,10,286,0,27.9,6,,
10/14/1927,1927,10,287,0,28.4,6,,
10/15/1927,1927,10,288,0,27,4.5,,
10/16/1927,1927,10,289,0,27,6.9,,
10/17/1927,1927,10,290,0,18.8,6.4,,
10/18/1927,1927,10,291,0,21.1,6.4,,
10/19/1927,1927,10,292,0,24.7,5.5,,
10/20/1927,1927,10,293,0,26.1,7.9,,
10/21/1927,1927,10,294,0,27.9,6.9,,
10/22/1927,1927,10,295,0,27.5,6.4,,
10/23/1927,1927,10,296,0,27.9,6,,
10/24/1927,1927,10,297,0,25.6,10.3,,
10/25/1927,1927,10,298,0,22.4,10.8,,
10/26/1927,1927,10,299,9.7,19.3,11.7,,
10/27/1927,1927,10,300,0,16.6,11.7,,
10/28/1927,1927,10,301,0,18.4,6.9,,
10/29/1927,1927,10,302,1.4,21.1,12.7,,
10/30/1927,1927,10,303,8.6,15.7,10.3,,
10/31/1927,1927,10,304,29.1,12,11.3,,
11/1/1927,1927,11,305,0,17.5,8.3,,
11/2/1927,1927,11,306,0,19.7,4.9,,
11/3/1927,1927,11,307,0,21.1,6.4,,
11/4/1927,1927,11,308,0,25.2,6.9,,
11/5/1927,1927,11,309,0.2,24.7,8.9,,
11/6/1927,1927,11,310,1.6,25.2,10.8,,
11/7/1927,1927,11,311,0,17,10.8,,
11/8/1927,1927,11,312,2.2,16.6,11.3,,
11/9/1927,1927,11,313,24.8,17.5,10.8,,
11/10/1927,1927,11,314,0,14.3,3.6,,
11/11/1927,1927,11,315,0,14.3,4.9,,
11/12/1927,1927,11,316,8.1,14.3,6.9,,
11/13/1927,1927,11,317,11.4,11.1,8.3,,
11/14/1927,1927,11,318,0,15.7,6.9,,
11/15/1927,1927,11,319,0,16.6,10.3,,
11/16/1927,1927,11,320,0,16.6,5.5,,
11/17/1927,1927,11,321,0,17,6.9,,
11/18/1927,1927,11,322,0.2,16.1,8.3,,
11/19/1927,1927,11,323,0,13.4,9.8,,
11/20/1927,1927,11,324,4.3,13.4,8.9,,
11/21/1927,1927,11,325,0,13.4,2.6,,
11/22/1927,1927,11,326,0,15.2,2.1,,
11/23/1927,1927,11,327,0,13.8,-0.8,,
11/24/1927,1927,11,328,0,13.4,-0.3,,
11/25/1927,1927,11,329,0,14.8,2.1,,
11/26/1927,1927,11,330,6.1,15.7,7.4,,
11/27/1927,1927,11,331,0,15.2,6.9,,
11/28/1927,1927,11,332,0.2,13.8,5.5,,
11/29/1927,1927,11,333,0,17,6.9,,
11/30/1927,1927,11,334,0,16.6,3.6,,
12/1/1927,1927,12,335,0,15.7,3.6,,
12/2/1927,1927,12,336,0,17.9,1.7,,
12/3/1927,1927,12,337,0,17.5,4.5,,
12/4/1927,1927,12,338,0,19.3,4.5,,
12/5/1927,1927,12,339,0,18.8,-0.3,,
12/6/1927,1927,12,340,0,15.7,0.6,,
12/7/1927,1927,12,341,0,12,-1.7,,
12/8/1927,1927,12,342,0,10.7,-3.7,,
12/9/1927,1927,12,343,0,12.9,0.6,,
12/10/1927,1927,12,344,3.7,15.2,3.6,,
12/11/1927,1927,12,345,0,8,1.1,,
12/12/1927,1927,12,346,0,12.5,-1.7,,
12/13/1927,1927,12,347,0.2,12.5,4.5,,
12/14/1927,1927,12,348,6.1,11.1,2.6,,
12/15/1927,1927,12,349,0,11.1,-0.3,,
12/16/1927,1927,12,350,0,13.4,-1.7,,
12/17/1927,1927,12,351,0,13.4,-1.3,,
12/18/1927,1927,12,352,0,16.1,-3.7,,
12/19/1927,1927,12,353,0,13.4,-1.7,,
12/20/1927,1927,12,354,0,12.5,-1.7,,
12/21/1927,1927,12,355,0,11.6,-0.3,,
12/22/1927,1927,12,356,0,14.8,-1.7,,
12/23/1927,1927,12,357,0,8.9,-2.2,,
12/24/1927,1927,12,358,10.7,11.1,2.6,,
12/25/1927,1927,12,359,20.7,10.2,4,,
12/26/1927,1927,12,360,0,10.2,2.6,,
12/27/1927,1927,12,361,1.1,16.6,4.5,,
12/28/1927,1927,12,362,0,12,4.5,,
12/29/1927,1927,12,363,7.8,10.7,4.9,,
12/30/1927,1927,12,364,0,12,-0.3,,
12/31/1927,1927,12,365,0.2,10.7,3,,
1/1/1928,1928,1,1,4.3,9.3,4.5,,
1/2/1928,1928,1,2,0,12.5,7.9,,
1/3/1928,1928,1,3,0.2,15.2,6.9,,
1/4/1928,1928,1,4,0,12,5.5,,
1/5/1928,1928,1,5,0.2,17,3,,
1/6/1928,1928,1,6,0,10.2,6.4,,
1/7/1928,1928,1,7,0,12.5,4.5,,
1/8/1928,1928,1,8,0,9.8,5.5,,
1/9/1928,1928,1,9,0,9.3,4.9,,
1/10/1928,1928,1,10,0,9.3,4,,
1/11/1928,1928,1,11,0.2,8.9,3.6,,
1/12/1928,1928,1,12,0,8.4,3,,
1/13/1928,1928,1,13,0.3,6.6,3,,
1/14/1928,1928,1,14,0,11.6,1.1,,
1/15/1928,1928,1,15,0,9.8,1.7,,
1/16/1928,1928,1,16,0,9.3,-1.3,,
1/17/1928,1928,1,17,0,11.1,-2.7,,
1/18/1928,1928,1,18,0,11.6,-3.2,,
1/19/1928,1928,1,19,0,11.1,-1.7,,
1/20/1928,1928,1,20,0,13.4,-1.3,,
1/21/1928,1928,1,21,0,16.1,-1.3,,
1/22/1928,1928,1,22,3.1,12,4.5,,
1/23/1928,1928,1,23,2.8,12.5,1.1,,
1/24/1928,1928,1,24,0,13.8,4.9,,
1/25/1928,1928,1,25,0,13.8,3,,
1/26/1928,1928,1,26,0,12.9,2.6,,
1/27/1928,1928,1,27,0,16.6,1.7,,
1/28/1928,1928,1,28,0,17,6.4,,
1/29/1928,1928,1,29,15.7,15.2,7.9,,
1/30/1928,1928,1,30,0,17.5,6,,
1/31/1928,1928,1,31,0,16.1,2.6,,
2/1/1928,1928,2,32,0.6,14.8,5.5,,
2/2/1928,1928,2,33,4.4,16.1,7.4,,
2/3/1928,1928,2,34,11.6,15.7,8.3,,
2/4/1928,1928,2,35,9.5,14.3,6.4,,
2/5/1928,1928,2,36,0,13.4,2.6,,
2/6/1928,1928,2,37,0,13.8,4.9,,
2/7/1928,1928,2,38,0,15.7,1.7,,
2/8/1928,1928,2,39,0,17,1.7,,
2/9/1928,1928,2,40,0,18.4,5.5,,
2/10/1928,1928,2,41,0,17.9,0.2,,
2/11/1928,1928,2,42,0,18.4,0.2,,
2/12/1928,1928,2,43,0,17.5,1.7,,
2/13/1928,1928,2,44,0,17,-0.3,,
2/14/1928,1928,2,45,0,17.5,1.7,,
2/15/1928,1928,2,46,0,15.2,1.7,,
2/16/1928,1928,2,47,0,14.3,3,,
2/17/1928,1928,2,48,0,17.9,-0.8,,
2/18/1928,1928,2,49,0,16.6,0.2,,
2/19/1928,1928,2,50,0,18.4,-0.3,,
2/20/1928,1928,2,51,0,20.2,0.2,,
2/21/1928,1928,2,52,0,19.7,1.7,,
2/22/1928,1928,2,53,0,17.5,0.6,,
2/23/1928,1928,2,54,1.3,16.1,1.7,,
2/24/1928,1928,2,55,0,15.7,2.6,,
2/25/1928,1928,2,56,3.2,12,5.5,,
2/26/1928,1928,2,57,0,15.7,3,,
2/27/1928,1928,2,58,0,17.9,1.7,,
2/28/1928,1928,2,59,0,17,5.5,,
2/29/1928,1928,2,60,3.6,17,6.4,,
3/1/1928,1928,3,61,0,16.1,8.3,,
3/2/1928,1928,3,62,0,17.9,7.4,,
3/3/1928,1928,3,63,9.7,17,9.8,,
3/4/1928,1928,3,64,8.5,16.6,8.9,,
3/5/1928,1928,3,65,0,19.3,7.9,,
3/6/1928,1928,3,66,0,18.8,8.3,,
3/7/1928,1928,3,67,0,20.6,6.9,,
3/8/1928,1928,3,68,2.9,17,3.6,,
3/9/1928,1928,3,69,0,17.5,11.7,,
3/10/1928,1928,3,70,0,20.2,6,,
3/11/1928,1928,3,71,0,21.5,7.4,,
3/12/1928,1928,3,72,0.6,15.2,6.4,,
3/13/1928,1928,3,73,0,19.3,8.9,,
3/14/1928,1928,3,74,0,18.8,4,,
3/15/1928,1928,3,75,0,20.2,5.5,,
3/16/1928,1928,3,76,0,22.9,4,,
3/17/1928,1928,3,77,0,23.8,7.4,,
3/18/1928,1928,3,78,0,24.7,6.4,,
3/19/1928,1928,3,79,0,26.1,7.9,,
3/20/1928,1928,3,80,0,23.4,3.6,,
3/21/1928,1928,3,81,0,23.4,4.9,,
3/22/1928,1928,3,82,3.2,21.1,7.9,,
3/23/1928,1928,3,83,26.2,16.1,11.7,,
3/24/1928,1928,3,84,22.7,14.8,11.3,,
3/25/1928,1928,3,85,8.2,15.2,11.3,,
3/26/1928,1928,3,86,19.4,17.5,13.2,,
3/27/1928,1928,3,87,0,17.9,5.5,,
3/28/1928,1928,3,88,0,15.2,1.1,,
3/29/1928,1928,3,89,0,16.6,2.6,,
3/30/1928,1928,3,90,0,19.7,5.5,,
3/31/1928,1928,3,91,0,20.2,6.9,,
4/1/1928,1928,4,92,0.5,16.6,9.8,,
4/2/1928,1928,4,93,33.1,14.8,7.4,,
4/3/1928,1928,4,94,1,13.4,3,,
4/4/1928,1928,4,95,0,14.8,4,,
4/5/1928,1928,4,96,0,17.5,4,,
4/6/1928,1928,4,97,0,22.4,6.4,,
4/7/1928,1928,4,98,0,23.8,12.2,,
4/8/1928,1928,4,99,0,23.4,10.3,,
4/9/1928,1928,4,100,0,24.3,6.9,,
4/10/1928,1928,4,101,0,21.1,6,,
4/11/1928,1928,4,102,0,19.7,6,,
4/12/1928,1928,4,103,1,18.8,11.3,,
4/13/1928,1928,4,104,0,21.5,6,,
4/14/1928,1928,4,105,0,22.9,4.9,,
4/15/1928,1928,4,106,0,22.4,7.9,,
4/16/1928,1928,4,107,2,21.5,8.9,,
4/17/1928,1928,4,108,0,16.6,2.6,,
4/18/1928,1928,4,109,0,16.6,1.7,,
4/19/1928,1928,4,110,0,18.8,3,,
4/20/1928,1928,4,111,0,19.3,4.9,,
4/21/1928,1928,4,112,0,21.1,7.9,,
4/22/1928,1928,4,113,0,24.7,7.4,,
4/23/1928,1928,4,114,0,25.6,7.9,,
4/24/1928,1928,4,115,0,18.8,3,,
4/25/1928,1928,4,116,0,19.7,4.9,,
4/26/1928,1928,4,117,0,24.3,5.5,,
4/27/1928,1928,4,118,0,24.7,7.9,,
4/28/1928,1928,4,119,0,24.7,7.4,,
4/29/1928,1928,4,120,0,28.4,11.7,,
4/30/1928,1928,4,121,0,29.7,10.8,,
5/1/1928,1928,5,122,0,19.3,7.4,,
5/2/1928,1928,5,123,0,24.7,5.5,,
5/3/1928,1928,5,124,0,22,8.9,,
5/4/1928,1928,5,125,0,24.7,6.9,,
5/5/1928,1928,5,126,0,26.5,9.8,,
5/6/1928,1928,5,127,0,27.9,8.9,,
5/7/1928,1928,5,128,5.1,25.6,13.6,,
5/8/1928,1928,5,129,1.5,21.1,12.7,,
5/9/1928,1928,5,130,0,15.7,11.3,,
5/10/1928,1928,5,131,0,18.4,10.8,,
5/11/1928,1928,5,132,0,19.7,12.7,,
5/12/1928,1928,5,133,0,23.8,11.3,,
5/13/1928,1928,5,134,0,29.3,10.8,,
5/14/1928,1928,5,135,0,28.4,8.9,,
5/15/1928,1928,5,136,0,22,9.8,,
5/16/1928,1928,5,137,0,25.2,9.3,,
5/17/1928,1928,5,138,0,26.5,10.3,,
5/18/1928,1928,5,139,0,27.9,10.8,,
5/19/1928,1928,5,140,0,28.4,10.3,,
5/20/1928,1928,5,141,0,28.8,10.8,,
5/21/1928,1928,5,142,0,24.7,10.8,,
5/22/1928,1928,5,143,0,26.5,9.3,,
5/23/1928,1928,5,144,0,26.5,10.8,,
5/24/1928,1928,5,145,0,30.2,13.2,,
5/25/1928,1928,5,146,0,31.6,11.3,,
5/26/1928,1928,5,147,0,30.2,10.8,,
5/27/1928,1928,5,148,0,28.4,12.2,,
5/28/1928,1928,5,149,0,27.5,10.8,,
5/29/1928,1928,5,150,0,30.6,14.1,,
5/30/1928,1928,5,151,0,24.3,8.9,,
5/31/1928,1928,5,152,0,25.2,8.3,,
6/1/1928,1928,6,153,0,27.9,9.8,,
6/2/1928,1928,6,154,0,30.2,13.6,,
6/3/1928,1928,6,155,0,32,16,,
6/4/1928,1928,6,156,0,32.5,26.2,,
6/5/1928,1928,6,157,0,32.9,15.6,,
6/6/1928,1928,6,158,0,34.7,14.7,,
6/7/1928,1928,6,159,0,34.3,12.7,,
6/8/1928,1928,6,160,0,30.6,10.8,,
6/9/1928,1928,6,161,0,31.1,10.8,,
6/10/1928,1928,6,162,0,26.5,10.8,,
6/11/1928,1928,6,163,0,19.7,7.9,,
6/12/1928,1928,6,164,0,23.8,9.3,,
6/13/1928,1928,6,165,0,26.1,9.3,,
6/14/1928,1928,6,166,0,23.4,11.7,,
6/15/1928,1928,6,167,0,25.2,9.3,,
6/16/1928,1928,6,168,0,27,9.8,,
6/17/1928,1928,6,169,0,27,10.3,,
6/18/1928,1928,6,170,0,27.5,20.4,,
6/19/1928,1928,6,171,0,27.9,12.7,,
6/20/1928,1928,6,172,0,22.9,10.8,,
6/21/1928,1928,6,173,0,20.2,8.3,,
6/22/1928,1928,6,174,0,26.5,9.3,,
6/23/1928,1928,6,175,0,30.2,10.8,,
6/24/1928,1928,6,176,0,29.3,12.7,,
6/25/1928,1928,6,177,0,27.5,10.8,,
6/26/1928,1928,6,178,0,26.5,9.3,,
6/27/1928,1928,6,179,0,24.3,9.8,,
6/28/1928,1928,6,180,0,23.8,9.8,,
6/29/1928,1928,6,181,0,22,9.8,,
6/30/1928,1928,6,182,0,25.6,11.3,,
7/1/1928,1928,7,183,0,23.8,10.3,,
7/2/1928,1928,7,184,0,28.4,13.6,,
7/3/1928,1928,7,185,0,22.4,12.2,,
7/4/1928,1928,7,186,0,23.8,12.2,,
7/5/1928,1928,7,187,0,24.7,10.8,,
7/6/1928,1928,7,188,0,27.9,12.7,,
7/7/1928,1928,7,189,0,31.1,16.6,,
7/8/1928,1928,7,190,0,33.8,13.6,,
7/9/1928,1928,7,191,0,26.1,12.2,,
7/10/1928,1928,7,192,0,24.3,8.9,,
7/11/1928,1928,7,193,0,30.2,13.2,,
7/12/1928,1928,7,194,0,30.2,14.1,,
7/13/1928,1928,7,195,0,29.7,13.2,,
7/14/1928,1928,7,196,0,30.2,11.3,,
7/15/1928,1928,7,197,0,32,15.1,,
7/16/1928,1928,7,198,0,29.7,15.1,,
7/17/1928,1928,7,199,0,29.3,11.3,,
7/18/1928,1928,7,200,0,26.5,10.8,,
7/19/1928,1928,7,201,0,31.1,10.3,,
7/20/1928,1928,7,202,0,30.6,11.3,,
7/21/1928,1928,7,203,0,30.6,13.2,,
7/22/1928,1928,7,204,0,27.5,10.3,,
7/23/1928,1928,7,205,0,31.6,13.6,,
7/24/1928,1928,7,206,0,29.7,13.6,,
7/25/1928,1928,7,207,0,32,14.1,,
7/26/1928,1928,7,208,0,32,14.1,,
7/27/1928,1928,7,209,0,31.6,11.3,,
7/28/1928,1928,7,210,0,31.6,12.2,,
7/29/1928,1928,7,211,0,31.1,10.8,,
7/30/1928,1928,7,212,0,33.4,10.3,,
7/31/1928,1928,7,213,0,32.5,12.7,,
8/1/1928,1928,8,214,0,26.5,12.2,,
8/2/1928,1928,8,215,0,29.3,10.8,,
8/3/1928,1928,8,216,0,29.3,12.7,,
8/4/1928,1928,8,217,0,27,10.8,,
8/5/1928,1928,8,218,0,27.5,13.2,,
8/6/1928,1928,8,219,0,26.5,12.2,,
8/7/1928,1928,8,220,0,28.8,12.2,,
8/8/1928,1928,8,221,0,30.2,13.6,,
8/9/1928,1928,8,222,0,31.1,11.3,,
8/10/1928,1928,8,223,0,34.3,14.1,,
8/11/1928,1928,8,224,0,30.2,13.6,,
8/12/1928,1928,8,225,0,32.9,15.6,,
8/13/1928,1928,8,226,0,32,17,,
8/14/1928,1928,8,227,0,27,12.7,,
8/15/1928,1928,8,228,0,28.8,12.7,,
8/16/1928,1928,8,229,0,27,10.8,,
8/17/1928,1928,8,230,0,30.6,12.2,,
8/18/1928,1928,8,231,0,30.2,10.8,,
8/19/1928,1928,8,232,0,30.6,10.8,,
8/20/1928,1928,8,233,0,32.5,12.7,,
8/21/1928,1928,8,234,0,32.9,12.7,,
8/22/1928,1928,8,235,0,29.3,12.2,,
8/23/1928,1928,8,236,0,32.5,12.7,,
8/24/1928,1928,8,237,0,28.4,12.7,,
8/25/1928,1928,8,238,0,23.8,11.3,,
8/26/1928,1928,8,239,0,21.1,12.7,,
8/27/1928,1928,8,240,0,24.3,13.2,,
8/28/1928,1928,8,241,0,25.6,9.3,,
8/29/1928,1928,8,242,0,29.3,10.3,,
8/30/1928,1928,8,243,0,29.7,12.7,,
8/31/1928,1928,8,244,0,29.7,9.3,,
9/1/1928,1928,9,245,0,27.9,6.9,,
9/2/1928,1928,9,246,0,30.6,8.3,,
9/3/1928,1928,9,247,0,31.1,10.3,,
9/4/1928,1928,9,248,0,29.7,7.4,,
9/5/1928,1928,9,249,0,29.3,8.9,,
9/6/1928,1928,9,250,0,30.6,11.3,,
9/7/1928,1928,9,251,0,32.5,13.2,,
9/8/1928,1928,9,252,0,30.2,11.3,,
9/9/1928,1928,9,253,0,26.5,9.3,,
9/10/1928,1928,9,254,0,25.6,6.9,,
9/11/1928,1928,9,255,0,21.1,8.3,,
9/12/1928,1928,9,256,0,21.1,9.3,,
9/13/1928,1928,9,257,0,20.6,16,,
9/14/1928,1928,9,258,0,26.5,9.3,,
9/15/1928,1928,9,259,0,28.4,17.5,,
9/16/1928,1928,9,260,0,28.8,14.7,,
9/17/1928,1928,9,261,0,29.3,10.3,,
9/18/1928,1928,9,262,0,29.3,11.3,,
9/19/1928,1928,9,263,0,29.7,10.8,,
9/20/1928,1928,9,264,0,27.9,20.4,,
9/21/1928,1928,9,265,0,30.2,16,,
9/22/1928,1928,9,266,0,32,11.3,,
9/23/1928,1928,9,267,0,32.5,11.3,,
9/24/1928,1928,9,268,0,29.3,8.9,,
9/25/1928,1928,9,269,0,23.4,8.9,,
9/26/1928,1928,9,270,0,23.4,12.7,,
9/27/1928,1928,9,271,0,19.3,8.3,,
9/28/1928,1928,9,272,0,19.3,8.3,,
9/29/1928,1928,9,273,0,22.9,12.2,,
9/30/1928,1928,9,274,0,24.3,10.8,,
10/1/1928,1928,10,275,0,23.4,7.9,,
10/2/1928,1928,10,276,0,26.5,10.8,,
10/3/1928,1928,10,277,0,22,7.4,,
10/4/1928,1928,10,278,0,19.7,9.8,,
10/5/1928,1928,10,279,0,20.2,8.3,,
10/6/1928,1928,10,280,0,23.8,7.9,,
10/7/1928,1928,10,281,0,25.6,9.3,,
10/8/1928,1928,10,282,0,26.5,11.3,,
10/9/1928,1928,10,283,0,29.3,10.3,,
10/10/1928,1928,10,284,0,28.8,10.8,,
10/11/1928,1928,10,285,0,19.7,10.8,,
10/12/1928,1928,10,286,0,17.9,10.3,,
10/13/1928,1928,10,287,0,18.4,4.5,,
10/14/1928,1928,10,288,0,19.7,2.1,,
10/15/1928,1928,10,289,0,22.4,5.5,,
10/16/1928,1928,10,290,0,24.3,6.9,,
10/17/1928,1928,10,291,0,24.7,8.9,,
10/18/1928,1928,10,292,0,25.6,8.3,,
10/19/1928,1928,10,293,0,27,11.3,,
10/20/1928,1928,10,294,0,28.4,8.3,,
10/21/1928,1928,10,295,0,22.9,6.4,,
10/22/1928,1928,10,296,0,21.5,4.5,,
10/23/1928,1928,10,297,0,24.3,8.9,,
10/24/1928,1928,10,298,0,21.1,8.3,,
10/25/1928,1928,10,299,0,19.3,3.6,,
10/26/1928,1928,10,300,0,22.4,3,,
10/27/1928,1928,10,301,0,19.3,4.9,,
10/28/1928,1928,10,302,0,19.3,3,,
10/29/1928,1928,10,303,0,19.7,7.4,,
10/30/1928,1928,10,304,0.5,16.1,9.8,,
10/31/1928,1928,10,305,0,17,6.4,,
11/1/1928,1928,11,306,0,18.4,7.9,,
11/2/1928,1928,11,307,0,20.2,6.9,,
11/3/1928,1928,11,308,14,17.5,6.9,,
11/4/1928,1928,11,309,0,17.5,7.9,,
11/5/1928,1928,11,310,0,20.2,10.8,,
11/6/1928,1928,11,311,0,15.2,6.9,,
11/7/1928,1928,11,312,0,15.7,6.4,,
11/8/1928,1928,11,313,0,17.9,4,,
11/9/1928,1928,11,314,0,18.4,4.5,,
11/10/1928,1928,11,315,0,18.4,8.9,,
11/11/1928,1928,11,316,0,18.8,3,,
11/12/1928,1928,11,317,10.2,9.8,6.9,,
11/13/1928,1928,11,318,16.8,11.6,4,,
11/14/1928,1928,11,319,45.9,12,7.4,,
11/15/1928,1928,11,320,0.8,14.8,4,,
11/16/1928,1928,11,321,0,14.8,2.6,,
11/17/1928,1928,11,322,0,17.5,8.3,,
11/18/1928,1928,11,323,0,15.2,4.9,,
11/19/1928,1928,11,324,0,15.2,3.6,,
11/20/1928,1928,11,325,0,17.5,1.1,,
11/21/1928,1928,11,326,0,17.9,2.1,,
11/22/1928,1928,11,327,0,17.9,1.7,,
11/23/1928,1928,11,328,0,17.9,3.6,,
11/24/1928,1928,11,329,0,17.9,1.7,,
11/25/1928,1928,11,330,0,18.4,1.1,,
11/26/1928,1928,11,331,0,15.7,4.5,,
11/27/1928,1928,11,332,0,16.1,4.5,,
11/28/1928,1928,11,333,0,16.1,2.6,,
11/29/1928,1928,11,334,0,14.8,0.2,,
11/30/1928,1928,11,335,0,15.7,-0.8,,
12/1/1928,1928,12,336,0,13.8,0.6,,
12/2/1928,1928,12,337,0,10.7,6.4,,
12/3/1928,1928,12,338,15.1,10.7,6.9,,
12/4/1928,1928,12,339,0,11.1,7.4,,
12/5/1928,1928,12,340,0,16.1,4.9,,
12/6/1928,1928,12,341,0,15.7,1.1,,
12/7/1928,1928,12,342,0,15.2,0.6,,
12/8/1928,1928,12,343,0,11.6,2.6,,
12/9/1928,1928,12,344,0,6.6,2.6,,
12/10/1928,1928,12,345,9.2,6.1,2.1,,
12/11/1928,1928,12,346,0,10.7,0.2,,
12/12/1928,1928,12,347,10.4,12,-0.3,,
12/13/1928,1928,12,348,0,7.1,0.6,,
12/14/1928,1928,12,349,0,8.9,1.1,,
12/15/1928,1928,12,350,0,10.2,-2.7,,
12/16/1928,1928,12,351,0,9.3,-2.7,,
12/17/1928,1928,12,352,0,8,-2.7,,
12/18/1928,1928,12,353,0,12,-2.2,,
12/19/1928,1928,12,354,0,11.6,-2.7,,
12/20/1928,1928,12,355,0,11.1,-3.7,,
12/21/1928,1928,12,356,0,11.6,-3.7,,
12/22/1928,1928,12,357,0,12.9,-3.2,,
12/23/1928,1928,12,358,16.6,5.7,-1.7,,
12/24/1928,1928,12,359,0,2.5,-1.3,,
12/25/1928,1928,12,360,0,7.1,-1.3,,
12/26/1928,1928,12,361,0,13.4,1.7,,
12/27/1928,1928,12,362,1.8,11.1,1.7,,
12/28/1928,1928,12,363,0,15.7,4,,
12/29/1928,1928,12,364,0.6,14.3,6.9,,
12/30/1928,1928,12,365,0,15.2,4.9,,
12/31/1928,1928,12,366,0,13.4,-0.3,,
1/1/1929,1929,1,1,0,11.1,0.6,,
1/2/1929,1929,1,2,0,8.9,4.5,,
1/3/1929,1929,1,3,0,8.9,4.5,,
1/4/1929,1929,1,4,0,14.3,0.2,,
1/5/1929,1929,1,5,0,10.7,2.6,,
1/6/1929,1929,1,6,0,13.4,0.6,,
1/7/1929,1929,1,7,0,15.7,-1.7,,
1/8/1929,1929,1,8,0,8,-0.8,,
1/9/1929,1929,1,9,0,7.1,-0.3,,
1/10/1929,1929,1,10,0,8.9,-0.3,,
1/11/1929,1929,1,11,0,5.7,-0.3,,
1/12/1929,1929,1,12,0,3.9,-0.3,,
1/13/1929,1929,1,13,0,3.9,-0.3,,
1/14/1929,1929,1,14,0,4.3,0.2,,
1/15/1929,1929,1,15,14.8,3.4,0.6,,
1/16/1929,1929,1,16,0,4.3,1.1,,
1/17/1929,1929,1,17,0,14.3,0.2,,
1/18/1929,1929,1,18,0.5,7.5,1.7,,
1/19/1929,1929,1,19,12.1,13.8,1.7,,
1/20/1929,1929,1,20,0,8.4,1.7,,
1/21/1929,1929,1,21,0,11.6,-1.7,,
1/22/1929,1929,1,22,0,10.7,-0.8,,
1/23/1929,1929,1,23,0,10.7,-0.8,,
1/24/1929,1929,1,24,0,10.2,0.2,,
1/25/1929,1929,1,25,0,12.9,0.2,,
1/26/1929,1929,1,26,0,12.5,-0.3,,
1/27/1929,1929,1,27,0,13.4,4,,
1/28/1929,1929,1,28,0,11.6,4,,
1/29/1929,1929,1,29,0,12.5,6,,
1/30/1929,1929,1,30,1.1,12,6.9,,
1/31/1929,1929,1,31,0,15.2,5.5,,
2/1/1929,1929,2,32,10.9,12.5,6.4,,
2/2/1929,1929,2,33,4.8,10.7,6.9,,
2/3/1929,1929,2,34,12.2,13.4,8.9,,
2/4/1929,1929,2,35,1.9,14.3,7.9,,
2/5/1929,1929,2,36,0,14.8,4,,
2/6/1929,1929,2,37,0,14.3,3,,
2/7/1929,1929,2,38,0,9.8,-1.7,,
2/8/1929,1929,2,39,0,8,-1.7,,
2/9/1929,1929,2,40,0,10.2,-2.7,,
2/10/1929,1929,2,41,0,11.1,-3.2,,
2/11/1929,1929,2,42,0,12.5,-3.7,,
2/12/1929,1929,2,43,0,14.3,-1.3,,
2/13/1929,1929,2,44,0,14.8,-2.2,,
2/14/1929,1929,2,45,0,15.7,0.6,,
2/15/1929,1929,2,46,0,16.6,-1.3,,
2/16/1929,1929,2,47,0,16.1,-1.7,,
2/17/1929,1929,2,48,0,15.7,0.2,,
2/18/1929,1929,2,49,0,13.4,4,,
2/19/1929,1929,2,50,0,14.8,-0.3,,
2/20/1929,1929,2,51,0,17,-1.7,,
2/21/1929,1929,2,52,0,17,0.2,,
2/22/1929,1929,2,53,0,19.7,1.7,,
2/23/1929,1929,2,54,0,18.8,4,,
2/24/1929,1929,2,55,0,17.5,5.5,,
2/25/1929,1929,2,56,0,17.5,2.6,,
2/26/1929,1929,2,57,0,18.4,4.5,,
2/27/1929,1929,2,58,0,16.1,-2.2,,
2/28/1929,1929,2,59,0,19.3,2.1,,
3/1/1929,1929,3,60,0,21.5,3.6,,
3/2/1929,1929,3,61,0,21.5,4.9,,
3/3/1929,1929,3,62,0,23.4,11.3,,
3/4/1929,1929,3,63,0,24.7,4,,
3/5/1929,1929,3,64,0,22.4,6,,
3/6/1929,1929,3,65,0,20.2,5.5,,
3/7/1929,1929,3,66,0,15.7,8.3,,
3/8/1929,1929,3,67,0,16.1,6.9,,
3/9/1929,1929,3,68,17,16.1,9.3,,
3/10/1929,1929,3,69,5.3,13.8,7.4,,
3/11/1929,1929,3,70,0,12.5,1.7,,
3/12/1929,1929,3,71,8.4,14.3,2.6,,
3/13/1929,1929,3,72,0,13.8,3,,
3/14/1929,1929,3,73,0,15.7,0.6,,
3/15/1929,1929,3,74,0,16.6,6,,
3/16/1929,1929,3,75,0,16.6,3,,
3/17/1929,1929,3,76,1.8,16.1,3.6,,
3/18/1929,1929,3,77,0,16.1,6,,
3/19/1929,1929,3,78,0,16.1,5.5,,
3/20/1929,1929,3,79,0,20.6,3,,
3/21/1929,1929,3,80,0,20.6,8.3,,
3/22/1929,1929,3,81,0,22,5.5,,
3/23/1929,1929,3,82,1.5,12.9,2.1,,
3/24/1929,1929,3,83,0,13.4,0.2,,
3/25/1929,1929,3,84,0,14.3,0.2,,
3/26/1929,1929,3,85,0,16.1,2.1,,
3/27/1929,1929,3,86,0,19.3,3.6,,
3/28/1929,1929,3,87,0,21.5,5.5,,
3/29/1929,1929,3,88,0,22,5.5,,
3/30/1929,1929,3,89,0,18.8,4.5,,
3/31/1929,1929,3,90,0,17,5.5,,
4/1/1929,1929,4,91,0,20.6,3.6,,
4/2/1929,1929,4,92,0,22,4.9,,
4/3/1929,1929,4,93,0,22.9,6,,
4/4/1929,1929,4,94,7.6,17,10.3,,
4/5/1929,1929,4,95,0,17.9,2.6,,
4/6/1929,1929,4,96,0,12,0.6,,
4/7/1929,1929,4,97,0,14.8,-0.8,,
4/8/1929,1929,4,98,0.3,16.1,7.9,,
4/9/1929,1929,4,99,0,15.2,-1.3,,
4/10/1929,1929,4,100,0,15.7,0.2,,
4/11/1929,1929,4,101,0,18.4,1.1,,
4/12/1929,1929,4,102,0,18.4,1.7,,
4/13/1929,1929,4,103,0,18.8,3.6,,
4/14/1929,1929,4,104,0,16.1,7.9,,
4/15/1929,1929,4,105,0,19.3,3,,
4/16/1929,1929,4,106,0,21.1,4.5,,
4/17/1929,1929,4,107,0,24.3,4,,
4/18/1929,1929,4,108,2.3,23.8,8.3,,
4/19/1929,1929,4,109,0,17,9.8,,
4/20/1929,1929,4,110,0,17.9,4.5,,
4/21/1929,1929,4,111,1,19.3,7.4,,
4/22/1929,1929,4,112,0,16.6,3,,
4/23/1929,1929,4,113,0,17.9,3.6,,
4/24/1929,1929,4,114,0,22.4,6.4,,
4/25/1929,1929,4,115,0,23.4,8.3,,
4/26/1929,1929,4,116,0,25.2,8.3,,
4/27/1929,1929,4,117,0,26.5,6.9,,
4/28/1929,1929,4,118,0,20.6,9.8,,
4/29/1929,1929,4,119,0,18.4,6,,
4/30/1929,1929,4,120,0,23.8,4.5,,
5/1/1929,1929,5,121,0,23.4,11.3,,
5/2/1929,1929,5,122,0,27,8.3,,
5/3/1929,1929,5,123,0,27,7.4,,
5/4/1929,1929,5,124,0,24.7,7.4,,
5/5/1929,1929,5,125,0,24.3,6,,
5/6/1929,1929,5,126,0,21.1,5.5,,
5/7/1929,1929,5,127,0,22.9,5.5,,
5/8/1929,1929,5,128,0,24.3,8.3,,
5/9/1929,1929,5,129,0,23.8,6.4,,
5/10/1929,1929,5,130,0,23.8,8.3,,
5/11/1929,1929,5,131,0,26.5,9.8,,
5/12/1929,1929,5,132,0,28.4,8.3,,
5/13/1929,1929,5,133,0,26.5,11.3,,
5/14/1929,1929,5,134,0,24.3,10.3,,
5/15/1929,1929,5,135,0,25.6,8.9,,
5/16/1929,1929,5,136,0,24.3,9.3,,
5/17/1929,1929,5,137,0,24.7,8.3,,
5/18/1929,1929,5,138,0,21.5,7.9,,
5/19/1929,1929,5,139,0,23.4,9.3,,
5/20/1929,1929,5,140,0,21.5,9.3,,
5/21/1929,1929,5,141,0,24.3,9.3,,
5/22/1929,1929,5,142,0,28.4,11.3,,
5/23/1929,1929,5,143,0,24.3,10.3,,
5/24/1929,1929,5,144,0,25.6,9.3,,
5/25/1929,1929,5,145,0,27.5,11.7,,
5/26/1929,1929,5,146,0,24.3,13.2,,
5/27/1929,1929,5,147,0,19.7,13.6,,
5/28/1929,1929,5,148,0,23.8,7.4,,
5/29/1929,1929,5,149,0,24.3,6.9,,
5/30/1929,1929,5,150,0,24.7,7.9,,
5/31/1929,1929,5,151,0,18.8,7.4,,
6/1/1929,1929,6,152,0,17,4,,
6/2/1929,1929,6,153,0,21.1,6.4,,
6/3/1929,1929,6,154,0,23.8,9.8,,
6/4/1929,1929,6,155,0,22,11.7,,
6/5/1929,1929,6,156,0,18.4,7.9,,
6/6/1929,1929,6,157,0,18.4,6.4,,
6/7/1929,1929,6,158,0,19.3,11.7,,
6/8/1929,1929,6,159,1.4,19.7,9.8,,
6/9/1929,1929,6,160,11.1,21.5,12.2,,
6/10/1929,1929,6,161,0,19.7,11.7,,
6/11/1929,1929,6,162,0,21.1,8.3,,
6/12/1929,1929,6,163,0,25.2,10.8,,
6/13/1929,1929,6,164,0,28.4,11.7,,
6/14/1929,1929,6,165,0,27.5,12.7,,
6/15/1929,1929,6,166,12.8,27,14.1,,
6/16/1929,1929,6,167,0.8,16.6,9.3,,
6/17/1929,1929,6,168,0,17.5,6.9,,
6/18/1929,1929,6,169,0,22,8.3,,
6/19/1929,1929,6,170,0,25.6,13.6,,
6/20/1929,1929,6,171,0,30.2,12.2,,
6/21/1929,1929,6,172,0,33.4,20.4,,
6/22/1929,1929,6,173,0,33.4,19,,
6/23/1929,1929,6,174,0,33.8,17,,
6/24/1929,1929,6,175,0,34.7,16,,
6/25/1929,1929,6,176,0,36.1,15.1,,
6/26/1929,1929,6,177,0,34.7,13.6,,
6/27/1929,1929,6,178,0,32.5,15.6,,
6/28/1929,1929,6,179,0,33.4,13.6,,
6/29/1929,1929,6,180,0,29.7,14.1,,
6/30/1929,1929,6,181,0,33.8,16.6,,
7/1/1929,1929,7,182,0,32.9,12.7,,
7/2/1929,1929,7,183,0,33.4,13.2,,
7/3/1929,1929,7,184,0,34.3,16.6,,
7/4/1929,1929,7,185,0,33.4,13.6,,
7/5/1929,1929,7,186,0,35.2,18,,
7/6/1929,1929,7,187,0,33.8,15.1,,
7/7/1929,1929,7,188,0,31.1,14.7,,
7/8/1929,1929,7,189,0,30.6,12.7,,
7/9/1929,1929,7,190,0,27.9,12.7,,
7/10/1929,1929,7,191,0,25.6,12.2,,
7/11/1929,1929,7,192,0,23.4,11.7,,
7/12/1929,1929,7,193,0,26.1,10.8,,
7/13/1929,1929,7,194,0,27.5,13.2,,
7/14/1929,1929,7,195,0,25.6,9.8,,
7/15/1929,1929,7,196,0,28.4,11.7,,
7/16/1929,1929,7,197,0,30.2,11.3,,
7/17/1929,1929,7,198,0,30.6,11.3,,
7/18/1929,1929,7,199,0,27.9,11.7,,
7/19/1929,1929,7,200,0,26.5,12.2,,
7/20/1929,1929,7,201,0,28.4,10.3,,
7/21/1929,1929,7,202,0,26.1,10.8,,
7/22/1929,1929,7,203,0,28.4,9.3,,
7/23/1929,1929,7,204,0,30.2,11.7,,
7/24/1929,1929,7,205,0,28.4,12.2,,
7/25/1929,1929,7,206,0,29.7,11.7,,
7/26/1929,1929,7,207,0,28.4,11.7,,
7/27/1929,1929,7,208,0,26.5,10.8,,
7/28/1929,1929,7,209,0,30.2,11.3,,
7/29/1929,1929,7,210,0,24.7,14.1,,
7/30/1929,1929,7,211,0,24.7,14.1,,
7/31/1929,1929,7,212,0,22.4,12.7,,
8/1/1929,1929,8,213,0,22,11.7,,
8/2/1929,1929,8,214,0,22.9,12.2,,
8/3/1929,1929,8,215,0,27.5,11.3,,
8/4/1929,1929,8,216,0,30.2,11.3,,
8/5/1929,1929,8,217,0,28.4,10.8,,
8/6/1929,1929,8,218,0,28.4,9.3,,
8/7/1929,1929,8,219,0,30.2,11.7,,
8/8/1929,1929,8,220,0,31.1,9.3,,
8/9/1929,1929,8,221,0,31.6,13.6,,
8/10/1929,1929,8,222,0,33.4,14.7,,
8/11/1929,1929,8,223,0,31.6,13.2,,
8/12/1929,1929,8,224,0,27.9,12.7,,
8/13/1929,1929,8,225,0,32,15.6,,
8/14/1929,1929,8,226,0,34.7,17,,
8/15/1929,1929,8,227,0,30.2,15.6,,
8/16/1929,1929,8,228,0,27.9,15.6,,
8/17/1929,1929,8,229,0,27.9,11.3,,
8/18/1929,1929,8,230,0,29.3,12.7,,
8/19/1929,1929,8,231,0,30.2,12.2,,
8/20/1929,1929,8,232,0,32.5,13.2,,
8/21/1929,1929,8,233,0,32.5,12.7,,
8/22/1929,1929,8,234,0,31.6,15.6,,
8/23/1929,1929,8,235,0,27.9,13.2,,
8/24/1929,1929,8,236,0,25.6,12.2,,
8/25/1929,1929,8,237,0,26.1,13.2,,
8/26/1929,1929,8,238,0,23.4,9.3,,
8/27/1929,1929,8,239,0,24.3,7.9,,
8/28/1929,1929,8,240,0,27.9,11.7,,
8/29/1929,1929,8,241,0,30.2,13.2,,
8/30/1929,1929,8,242,0,28.8,10.8,,
8/31/1929,1929,8,243,0,30.2,14.7,,
9/1/1929,1929,9,244,0,27,11.3,,
9/2/1929,1929,9,245,0,27,10.3,,
9/3/1929,1929,9,246,0,26.1,11.7,,
9/4/1929,1929,9,247,0,28.8,14.1,,
9/5/1929,1929,9,248,0,24.3,11.7,,
9/6/1929,1929,9,249,0,20.6,11.7,,
9/7/1929,1929,9,250,0,21.1,14.1,,
9/8/1929,1929,9,251,0,23.4,12.7,,
9/9/1929,1929,9,252,0,27,14.1,,
9/10/1929,1929,9,253,0,27,11.7,,
9/11/1929,1929,9,254,0,29.7,15.6,,
9/12/1929,1929,9,255,0,30.6,12.7,,
9/13/1929,1929,9,256,0,32.5,14.1,,
9/14/1929,1929,9,257,0,33.8,14.7,,
9/15/1929,1929,9,258,0,32.9,13.2,,
9/16/1929,1929,9,259,0,32.5,11.7,,
9/17/1929,1929,9,260,0,31.6,12.2,,
9/18/1929,1929,9,261,0,31.6,14.7,,
9/19/1929,1929,9,262,0,25.6,16,,
9/20/1929,1929,9,263,0,22.4,16,,
9/21/1929,1929,9,264,0,22,12.7,,
9/22/1929,1929,9,265,0,22.9,7.4,,
9/23/1929,1929,9,266,0,22.9,7.4,,
9/24/1929,1929,9,267,0,21.1,7.4,,
9/25/1929,1929,9,268,0,24.3,7.9,,
9/26/1929,1929,9,269,0,22.9,11.7,,
9/27/1929,1929,9,270,0,20.2,6,,
9/28/1929,1929,9,271,0,22.9,6,,
9/29/1929,1929,9,272,0,24.3,6.4,,
9/30/1929,1929,9,273,0,23.4,4.9,,
